scripts/network-gpu-ansor-logs.json
{"i": [["[\"3998ca0cea6769eaeeef8654ebf4ca61\"]", "cuda"], [[], [["CHW", 2, "local"], ["SP", 2, 0, 1, [1, 1, 1, 1], 1], ["SP", 2, 5, 128, [2, 4, 2, 1], 1], ["SP", 2, 10, 768, [1, 16, 1, 1], 1], ["SP", 2, 15, 3072, [16, 8], 1], ["RE", 2, [0, 5, 10, 1, 6, 11, 2, 7, 12, 15, 16, 3, 8, 13, 17, 4, 9, 14]], ["FSP", 3, 0, 1, 3], ["FSP", 3, 4, 2, 3], ["FSP", 3, 8, 3, 3], ["RE", 3, [0, 4, 8, 1, 5, 9, 2, 6, 10, 3, 7, 11]], ["CA", 2, 3, 8], ["CHR", 1, "shared", [2]], ["CA", 2, 3, 9], ["CHR", 0, "shared", [3]], ["CA", 1, 4, 9], ["FU", 5, [0, 1, 2]], ["AN", 5, 0, 5], ["FU", 5, [1, 2, 3]], ["AN", 5, 1, 4], ["FU", 5, [2, 3, 4]], ["AN", 5, 2, 6], ["FU", 1, [0, 1, 2]], ["SP", 1, 0, 4, [2], 1], ["AN", 1, 1, 2], ["FFSP", 1, 0, [3, 2, 1], 1, 1], ["AN", 1, 1, 6], ["FU", 3, [0, 1, 2]], ["SP", 3, 0, 16, [4], 1], ["AN", 3, 1, 2], ["FFSP", 3, 0, [3, 2, 1], 1, 1], ["AN", 3, 1, 6], ["PR", 4, 0, "auto_unroll_max_step$512"]]]], "r": [[0.000104564], 0, 3.81254, 1595022215], "v": "v0.2"}
{"i": [["[\"91fab3bc761bd02d45bebca243b68447\"]", "cuda"], [[], [["CHW", 2, "local"], ["SP", 2, 0, 1, [1, 1, 1, 1], 1], ["SP", 2, 5, 128, [1, 8, 1, 4], 1], ["SP", 2, 10, 3072, [1, 16, 2, 1], 1], ["SP", 2, 15, 768, [32, 2], 1], ["RE", 2, [0, 5, 10, 1, 6, 11, 2, 7, 12, 15, 16, 3, 8, 13, 17, 4, 9, 14]], ["FSP", 3, 0, 1, 3], ["FSP", 3, 4, 2, 3], ["FSP", 3, 8, 3, 3], ["RE", 3, [0, 4, 8, 1, 5, 9, 2, 6, 10, 3, 7, 11]], ["CA", 2, 3, 8], ["CHR", 1, "shared", [2]], ["CA", 2, 3, 9], ["CHR", 0, "shared", [3]], ["CA", 1, 4, 9], ["FU", 5, [0, 1, 2]], ["AN", 5, 0, 5], ["FU", 5, [1, 2, 3]], ["AN", 5, 1, 4], ["FU", 5, [2, 3, 4]], ["AN", 5, 2, 6], ["FU", 1, [0, 1, 2]], ["SP", 1, 0, 128, [4], 1], ["AN", 1, 1, 2], ["FFSP", 1, 0, [3, 2, 1], 1, 1], ["AN", 1, 1, 6], ["FU", 3, [0, 1, 2]], ["SP", 3, 0, 32, [4], 1], ["AN", 3, 1, 2], ["FFSP", 3, 0, [3, 2, 1], 1, 1], ["AN", 3, 1, 6], ["PR", 4, 0, "auto_unroll_max_step$512"]]]], "r": [[6.7287e-05], 0, 2.9056, 1595028561], "v": "v0.2"}
{"i": [["[\"5d1f049452dbfdf40666d14265983267\"]", "cuda"], [[], [["CHW", 2, "local"], ["SP", 2, 0, 1, [1, 1, 1, 1], 1], ["SP", 2, 5, 128, [2, 4, 1, 2], 1], ["SP", 2, 10, 768, [1, 16, 1, 1], 1], ["SP", 2, 15, 768, [4, 8], 1], ["RE", 2, [0, 5, 10, 1, 6, 11, 2, 7, 12, 15, 16, 3, 8, 13, 17, 4, 9, 14]], ["FSP", 3, 0, 1, 3], ["FSP", 3, 4, 2, 3], ["FSP", 3, 8, 3, 3], ["RE", 3, [0, 4, 8, 1, 5, 9, 2, 6, 10, 3, 7, 11]], ["CA", 2, 3, 8], ["CHR", 1, "shared", [2]], ["CA", 2, 3, 9], ["CHR", 0, "shared", [3]], ["CA", 1, 4, 9], ["FU", 5, [0, 1, 2]], ["AN", 5, 0, 5], ["FU", 5, [1, 2, 3]], ["AN", 5, 1, 4], ["FU", 5, [2, 3, 4]], ["AN", 5, 2, 6], ["FU", 1, [0, 1, 2]], ["SP", 1, 0, 8, [4], 1], ["AN", 1, 1, 2], ["FFSP", 1, 0, [3, 2, 1], 1, 1], ["AN", 1, 1, 6], ["FU", 3, [0, 1, 2]], ["SP", 3, 0, 4, [4], 1], ["AN", 3, 1, 2], ["FFSP", 3, 0, [3, 2, 1], 1, 1], ["AN", 3, 1, 6], ["PR", 4, 0, "auto_unroll_max_step$1024"]]]], "r": [[2.92088e-05], 0, 2.40148, 1595016420], "v": "v0.2"}
{"i": [["[\"ea4fe9fedf16ae621a41c816d1717dd0\"]", "cuda"], [[], [["CHW", 2, "local"], ["SP", 2, 0, 12, [1, 1, 1, 1], 1], ["SP", 2, 5, 128, [2, 4, 1, 2], 1], ["SP", 2, 10, 64, [1, 32, 1, 1], 1], ["SP", 2, 15, 128, [16, 2], 1], ["RE", 2, [0, 5, 10, 1, 6, 11, 2, 7, 12, 15, 16, 3, 8, 13, 17, 4, 9, 14]], ["FSP", 3, 0, 1, 3], ["FSP", 3, 4, 2, 3], ["FSP", 3, 8, 3, 3], ["RE", 3, [0, 4, 8, 1, 5, 9, 2, 6, 10, 3, 7, 11]], ["CA", 2, 3, 8], ["CHR", 1, "shared", [2]], ["CA", 2, 3, 9], ["CHR", 0, "shared", [3]], ["CA", 1, 4, 9], ["FU", 5, [0, 1, 2]], ["AN", 5, 0, 5], ["FU", 5, [1, 2, 3]], ["AN", 5, 1, 4], ["FU", 5, [2, 3, 4]], ["AN", 5, 2, 6], ["FU", 1, [0, 1, 2]], ["SP", 1, 0, 128, [4], 1], ["AN", 1, 1, 2], ["FFSP", 1, 0, [3, 2, 1], 1, 1], ["AN", 1, 1, 6], ["FU", 3, [0, 1, 2]], ["SP", 3, 0, 64, [4], 1], ["AN", 3, 1, 2], ["FFSP", 3, 0, [3, 2, 1], 1, 1], ["AN", 3, 1, 6], ["PR", 4, 0, "auto_unroll_max_step$1024"]]]], "r": [[6.69786e-06], 0, 2.77047, 1595031736], "v": "v0.2"}
{"i": [["[\"a36f8a80e85f63df20c4b3fe1d3d849f\"]", "cuda"], [[], [["SP", 5, 3, 128, [64], 1], ["AN", 5, 4, 6], ["FSP", 4, 3, 0, 1], ["AN", 4, 4, 6], ["CA", 4, 5, 2], ["CI", 3], ["CI", 2], ["FSP", 1, 3, 0, 1], ["AN", 1, 4, 6], ["CA", 1, 5, 2], ["FU", 5, [0, 1, 2]], ["AN", 5, 0, 5]]]], "r": [[5.00167e-06], 0, 2.07403, 1595006511], "v": "v0.2"}
{"i": [["[\"cfcc5623971e5c606a92c924b88caed6\"]", "cuda"], [[], [["CHW", 2, "local"], ["SP", 2, 0, 12, [1, 1, 1, 1], 1], ["SP", 2, 5, 128, [1, 4, 1, 4], 1], ["SP", 2, 10, 128, [2, 16, 1, 1], 1], ["SP", 2, 15, 64, [4, 16], 1], ["RE", 2, [0, 5, 10, 1, 6, 11, 2, 7, 12, 15, 16, 3, 8, 13, 17, 4, 9, 14]], ["FSP", 3, 0, 1, 3], ["FSP", 3, 4, 2, 3], ["FSP", 3, 8, 3, 3], ["RE", 3, [0, 4, 8, 1, 5, 9, 2, 6, 10, 3, 7, 11]], ["CA", 2, 3, 8], ["CHR", 1, "shared", [2]], ["CA", 2, 3, 9], ["CHR", 0, "shared", [3]], ["CA", 1, 4, 9], ["FU", 5, [0, 1, 2]], ["AN", 5, 0, 5], ["FU", 5, [1, 2, 3]], ["AN", 5, 1, 4], ["FU", 5, [2, 3, 4]], ["AN", 5, 2, 6], ["FU", 1, [0, 1, 2]], ["SP", 1, 0, 256, [2], 1], ["AN", 1, 1, 2], ["FFSP", 1, 0, [3, 2, 1], 1, 1], ["AN", 1, 1, 6], ["FU", 3, [0, 1, 2]], ["SP", 3, 0, 128, [2], 1], ["AN", 3, 1, 2], ["FFSP", 3, 0, [3, 2, 1], 1, 1], ["AN", 3, 1, 6], ["PR", 4, 0, "auto_unroll_max_step$512"]]]], "r": [[6.16639e-06], 0, 2.71312, 1595021958], "v": "v0.2"}
{"i": [["[\"9daf9ad535fc6fbbc30af7039d66a15d\"]", "cuda"], [[], [["CHW", 2, "local"], ["SP", 2, 0, 1, [1, 1, 1, 1], 1], ["SP", 2, 5, 128, [1, 32, 1, 1], 1], ["SP", 2, 10, 2304, [6, 2, 2, 1], 1], ["SP", 2, 15, 768, [3, 8], 1], ["RE", 2, [0, 5, 10, 1, 6, 11, 2, 7, 12, 15, 16, 3, 8, 13, 17, 4, 9, 14]], ["FSP", 3, 0, 1, 3], ["FSP", 3, 4, 2, 3], ["FSP", 3, 8, 3, 3], ["RE", 3, [0, 4, 8, 1, 5, 9, 2, 6, 10, 3, 7, 11]], ["CA", 2, 3, 8], ["CHR", 1, "shared", [2]], ["CA", 2, 3, 9], ["CHR", 0, "shared", [3]], ["CA", 1, 4, 9], ["FU", 5, [0, 1, 2]], ["AN", 5, 0, 5], ["FU", 5, [1, 2, 3]], ["AN", 5, 1, 4], ["FU", 5, [2, 3, 4]], ["AN", 5, 2, 6], ["FU", 1, [0, 1, 2]], ["SP", 1, 0, 4, [4], 1], ["AN", 1, 1, 2], ["FFSP", 1, 0, [3, 2, 1], 1, 1], ["AN", 1, 1, 6], ["FU", 3, [0, 1, 2]], ["SP", 3, 0, 48, [1], 1], ["AN", 3, 1, 2], ["FFSP", 3, 0, [3, 2, 1], 1, 1], ["AN", 3, 1, 6], ["PR", 4, 0, "auto_unroll_max_step$512"]]]], "r": [[6.69552e-05], 0, 3.09694, 1595011601], "v": "v0.2"}
{"i": [["[\"00eae41720fe839cc8c8be69bf49571e\"]", "cuda"], [[], [["SP", 2, 2, 1, [32], 1], ["AN", 2, 3, 6], ["FSP", 1, 3, 0, 1], ["AN", 1, 4, 6], ["CA", 1, 2, 2], ["FU", 2, [0, 1, 2]], ["AN", 2, 0, 5]]]], "r": [[3.23504e-06], 0, 1.77833, 1595007055], "v": "v0.2"}
{"i": [["[\"616218b145b71f8ebe8df1799550880a\"]", "cuda"], [[], [["SP", 5, 2, 1, [32], 1], ["AN", 5, 3, 6], ["FSP", 4, 3, 0, 1], ["AN", 4, 4, 6], ["CA", 4, 5, 2], ["CI", 3], ["CI", 2], ["FU", 5, [0, 1, 2]], ["AN", 5, 0, 5]]]], "r": [[1.04595e-05], 0, 2.10418, 1595007099], "v": "v0.2"}
{"i": [["[\"acfaa711793dc3cdf1cef1dece04d317\"]", "cuda"], [[], [["CI", 6], ["CI", 5], ["CI", 4], ["SP", 2, 0, 1, [1, 1, 1, 1], 1], ["SP", 2, 5, 768, [1, 32, 1, 1], 1], ["SP", 2, 10, 768, [16, 2], 1], ["RE", 2, [0, 5, 1, 6, 2, 7, 10, 11, 3, 8, 12, 4, 9]], ["FSP", 7, 0, 3, 3], ["FSP", 7, 4, 4, 3], ["RE", 7, [0, 4, 1, 5, 2, 6, 3, 7]], ["CA", 2, 7, 5], ["CHR", 1, "shared", [2]], ["CA", 2, 3, 6], ["CHR", 0, "shared", [3]], ["CA", 1, 4, 6], ["FU", 9, [0, 1]], ["AN", 9, 0, 5], ["FU", 9, [1, 2]], ["AN", 9, 1, 4], ["FU", 9, [2, 3]], ["AN", 9, 2, 6], ["FU", 1, [0, 1]], ["SP", 1, 0, 32, [1], 1], ["AN", 1, 1, 2], ["FFSP", 1, 0, [4, 3], 1, 1], ["AN", 1, 1, 6], ["FU", 3, [0, 1]], ["SP", 3, 0, 32, [1], 1], ["AN", 3, 1, 2], ["FFSP", 3, 0, [4, 3], 1, 1], ["AN", 3, 1, 6], ["PR", 4, 0, "auto_unroll_max_step$0"]]]], "r": [[2.21674e-05], 0, 2.27524, 1595007275], "v": "v0.2"}
{"i": [["[\"e9e1e8c1e659e667c8d5fcce1077801e\"]", "cuda"], [[], [["CHW", 2, "local"], ["SP", 2, 0, 16, [1, 1, 1, 1], 1], ["SP", 2, 5, 128, [1, 16, 4, 1], 1], ["SP", 2, 10, 768, [2, 8, 1, 4], 1], ["SP", 2, 15, 3072, [8, 4], 1], ["RE", 2, [0, 5, 10, 1, 6, 11, 2, 7, 12, 15, 16, 3, 8, 13, 17, 4, 9, 14]], ["FSP", 3, 0, 1, 3], ["FSP", 3, 4, 2, 3], ["FSP", 3, 8, 3, 3], ["RE", 3, [0, 4, 8, 1, 5, 9, 2, 6, 10, 3, 7, 11]], ["CA", 2, 3, 8], ["CHR", 1, "shared", [2]], ["CA", 2, 3, 9], ["CHR", 0, "shared", [3]], ["CA", 1, 4, 9], ["FU", 5, [0, 1, 2]], ["AN", 5, 0, 5], ["FU", 5, [1, 2, 3]], ["AN", 5, 1, 4], ["FU", 5, [2, 3, 4]], ["AN", 5, 2, 6], ["FU", 1, [0, 1, 2]], ["SP", 1, 0, 128, [2], 1], ["AN", 1, 1, 2], ["FFSP", 1, 0, [3, 2, 1], 1, 1], ["AN", 1, 1, 6], ["FU", 3, [0, 1, 2]], ["SP", 3, 0, 64, [4], 1], ["AN", 3, 1, 2], ["FFSP", 3, 0, [3, 2, 1], 1, 1], ["AN", 3, 1, 6], ["PR", 4, 0, "auto_unroll_max_step$512"]]]], "r": [[0.000782811], 0, 10.3522, 1595961876], "v": "v0.2"}
{"i": [["[\"a84a6cdd3a8363ce14c46742c7afd466\"]", "cuda"], [[], [["CHW", 2, "local"], ["SP", 2, 0, 16, [1, 1, 1, 1], 1], ["SP", 2, 5, 128, [1, 8, 4, 2], 1], ["SP", 2, 10, 3072, [4, 16, 2, 1], 1], ["SP", 2, 15, 768, [2, 4], 1], ["RE", 2, [0, 5, 10, 1, 6, 11, 2, 7, 12, 15, 16, 3, 8, 13, 17, 4, 9, 14]], ["FSP", 3, 0, 1, 3], ["FSP", 3, 4, 2, 3], ["FSP", 3, 8, 3, 3], ["RE", 3, [0, 4, 8, 1, 5, 9, 2, 6, 10, 3, 7, 11]], ["CA", 2, 3, 8], ["CHR", 1, "shared", [2]], ["CA", 2, 3, 9], ["CHR", 0, "shared", [3]], ["CA", 1, 4, 9], ["FU", 5, [0, 1, 2]], ["AN", 5, 0, 5], ["FU", 5, [1, 2, 3]], ["AN", 5, 1, 4], ["FU", 5, [2, 3, 4]], ["AN", 5, 2, 6], ["FU", 1, [0, 1, 2]], ["SP", 1, 0, 64, [2], 1], ["AN", 1, 1, 2], ["FFSP", 1, 0, [3, 2, 1], 1, 1], ["AN", 1, 1, 6], ["FU", 3, [0, 1, 2]], ["SP", 3, 0, 16, [4], 1], ["AN", 3, 1, 2], ["FFSP", 3, 0, [3, 2, 1], 1, 1], ["AN", 3, 1, 6], ["PR", 4, 0, "auto_unroll_max_step$512"]]]], "r": [[0.000772346], 0, 10.327, 1595950825], "v": "v0.2"}
{"i": [["[\"5c4f006bbba0c90f815a0bd914d6ded5\"]", "cuda"], [[], [["CHW", 2, "local"], ["SP", 2, 0, 16, [1, 1, 1, 1], 1], ["SP", 2, 5, 128, [2, 4, 2, 1], 1], ["SP", 2, 10, 768, [1, 32, 1, 3], 1], ["SP", 2, 15, 768, [32, 1], 1], ["RE", 2, [0, 5, 10, 1, 6, 11, 2, 7, 12, 15, 16, 3, 8, 13, 17, 4, 9, 14]], ["FSP", 3, 0, 1, 3], ["FSP", 3, 4, 2, 3], ["FSP", 3, 8, 3, 3], ["RE", 3, [0, 4, 8, 1, 5, 9, 2, 6, 10, 3, 7, 11]], ["CA", 2, 3, 8], ["CHR", 1, "shared", [2]], ["CA", 2, 3, 9], ["CHR", 0, "shared", [3]], ["CA", 1, 4, 9], ["FU", 5, [0, 1, 2]], ["AN", 5, 0, 5], ["FU", 5, [1, 2, 3]], ["AN", 5, 1, 4], ["FU", 5, [2, 3, 4]], ["AN", 5, 2, 6], ["FU", 1, [0, 1, 2]], ["SP", 1, 0, 48, [1], 1], ["AN", 1, 1, 2], ["FFSP", 1, 0, [3, 2, 1], 1, 1], ["AN", 1, 1, 6], ["FU", 3, [0, 1, 2]], ["SP", 3, 0, 144, [4], 1], ["AN", 3, 1, 2], ["FFSP", 3, 0, [3, 2, 1], 1, 1], ["AN", 3, 1, 6], ["PR", 4, 0, "auto_unroll_max_step$1024"]]]], "r": [[0.000257664], 0, 4.49425, 1595912794], "v": "v0.2"}
{"i": [["[\"bf88f3daf1abc1973933664b7caa5b60\"]", "cuda"], [[], [["CHW", 2, "local"], ["SP", 2, 0, 192, [1, 1, 1, 1], 1], ["SP", 2, 5, 128, [4, 8, 1, 2], 1], ["SP", 2, 10, 64, [1, 16, 1, 2], 1], ["SP", 2, 15, 128, [1, 32], 1], ["RE", 2, [0, 5, 10, 1, 6, 11, 2, 7, 12, 15, 16, 3, 8, 13, 17, 4, 9, 14]], ["FSP", 3, 0, 1, 3], ["FSP", 3, 4, 2, 3], ["FSP", 3, 8, 3, 3], ["RE", 3, [0, 4, 8, 1, 5, 9, 2, 6, 10, 3, 7, 11]], ["CA", 2, 3, 8], ["CHR", 1, "shared", [2]], ["CA", 2, 3, 9], ["CHR", 0, "shared", [3]], ["CA", 1, 4, 9], ["FU", 5, [0, 1, 2]], ["AN", 5, 0, 5], ["FU", 5, [1, 2, 3]], ["AN", 5, 1, 4], ["FU", 5, [2, 3, 4]], ["AN", 5, 2, 6], ["FU", 1, [0, 1, 2]], ["SP", 1, 0, 128, [1], 1], ["AN", 1, 1, 2], ["FFSP", 1, 0, [3, 2, 1], 1, 1], ["AN", 1, 1, 6], ["FU", 3, [0, 1, 2]], ["SP", 3, 0, 128, [4], 1], ["AN", 3, 1, 2], ["FFSP", 3, 0, [3, 2, 1], 1, 1], ["AN", 3, 1, 6], ["PR", 4, 0, "auto_unroll_max_step$16"]]]], "r": [[4.60267e-05], 0, 3.48302, 1595947269], "v": "v0.2"}
{"i": [["[\"37a549b60edf447bef5050f609d1ecc1\"]", "cuda"], [[], [["SP", 5, 3, 128, [64], 1], ["AN", 5, 4, 6], ["FSP", 4, 3, 0, 1], ["AN", 4, 4, 6], ["CA", 4, 5, 2], ["CI", 3], ["CI", 2], ["FSP", 1, 3, 0, 1], ["AN", 1, 4, 6], ["CA", 1, 5, 2], ["FU", 5, [0, 1, 2]], ["AN", 5, 0, 5]]]], "r": [[3.89214e-05], 0, 3.28291, 1595879982], "v": "v0.2"}
{"i": [["[\"a8ecda853b1ebf488d27086becaf6db0\"]", "cuda"], [[], [["CHW", 2, "local"], ["SP", 2, 0, 192, [1, 1, 1, 1], 1], ["SP", 2, 5, 128, [4, 2, 2, 2], 1], ["SP", 2, 10, 128, [1, 64, 2, 1], 1], ["SP", 2, 15, 64, [16, 1], 1], ["RE", 2, [0, 5, 10, 1, 6, 11, 2, 7, 12, 15, 16, 3, 8, 13, 17, 4, 9, 14]], ["FSP", 3, 0, 1, 3], ["FSP", 3, 4, 2, 3], ["FSP", 3, 8, 3, 3], ["RE", 3, [0, 4, 8, 1, 5, 9, 2, 6, 10, 3, 7, 11]], ["CA", 2, 3, 8], ["CHR", 1, "shared", [2]], ["CA", 2, 3, 9], ["CHR", 0, "shared", [3]], ["CA", 1, 4, 9], ["FU", 5, [0, 1, 2]], ["AN", 5, 0, 5], ["FU", 5, [1, 2, 3]], ["AN", 5, 1, 4], ["FU", 5, [2, 3, 4]], ["AN", 5, 2, 6], ["FU", 1, [0, 1, 2]], ["SP", 1, 0, 4, [2], 1], ["AN", 1, 1, 2], ["FFSP", 1, 0, [3, 2, 1], 1, 1], ["AN", 1, 1, 6], ["FU", 3, [0, 1, 2]], ["SP", 3, 0, 2, [2], 1], ["AN", 3, 1, 2], ["FFSP", 3, 0, [3, 2, 1], 1, 1], ["AN", 3, 1, 6], ["PR", 4, 0, "auto_unroll_max_step$512"]]]], "r": [[4.97645e-05], 0, 4.1419, 1595966646], "v": "v0.2"}
{"i": [["[\"6f78bbc712e7700b557b85fdb40eb872\"]", "cuda"], [[], [["CHW", 2, "local"], ["SP", 2, 0, 16, [1, 1, 1, 1], 1], ["SP", 2, 5, 128, [2, 16, 4, 1], 1], ["SP", 2, 10, 2304, [6, 8, 1, 1], 1], ["SP", 2, 15, 768, [6, 2], 1], ["RE", 2, [0, 5, 10, 1, 6, 11, 2, 7, 12, 15, 16, 3, 8, 13, 17, 4, 9, 14]], ["FSP", 3, 0, 1, 3], ["FSP", 3, 4, 2, 3], ["FSP", 3, 8, 3, 3], ["RE", 3, [0, 4, 8, 1, 5, 9, 2, 6, 10, 3, 7, 11]], ["CA", 2, 3, 8], ["CHR", 1, "shared", [2]], ["CA", 2, 3, 9], ["CHR", 0, "shared", [3]], ["CA", 1, 4, 9], ["FU", 5, [0, 1, 2]], ["AN", 5, 0, 5], ["FU", 5, [1, 2, 3]], ["AN", 5, 1, 4], ["FU", 5, [2, 3, 4]], ["AN", 5, 2, 6], ["FU", 1, [0, 1, 2]], ["SP", 1, 0, 4, [4], 1], ["AN", 1, 1, 2], ["FFSP", 1, 0, [3, 2, 1], 1, 1], ["AN", 1, 1, 6], ["FU", 3, [0, 1, 2]], ["SP", 3, 0, 8, [1], 1], ["AN", 3, 1, 2], ["FFSP", 3, 0, [3, 2, 1], 1, 1], ["AN", 3, 1, 6], ["PR", 4, 0, "auto_unroll_max_step$512"]]]], "r": [[0.00066088], 0, 8.78037, 1595938975], "v": "v0.2"}
{"i": [["[\"95439526520346807f89f16359271bde\"]", "cuda"], [[], [["SP", 2, 2, 1, [32], 1], ["AN", 2, 3, 6], ["FSP", 1, 3, 0, 1], ["AN", 1, 4, 6], ["CA", 1, 2, 2], ["FU", 2, [0, 1, 2]], ["AN", 2, 0, 5]]]], "r": [[5.33933e-06], 0, 2.79342, 1595881016], "v": "v0.2"}
{"i": [["[\"a3c7e70667fb8c2435263be39202306d\"]", "cuda"], [[], [["SP", 5, 2, 1, [32], 1], ["AN", 5, 3, 6], ["FSP", 4, 3, 0, 1], ["AN", 4, 4, 6], ["CA", 4, 5, 2], ["CI", 3], ["CI", 2], ["FU", 5, [0, 1, 2]], ["AN", 5, 0, 5]]]], "r": [[2.3339e-05], 0, 2.3544, 1595881139], "v": "v0.2"}
{"i": [["[\"bbe3ae2e3abcc004634b089e80b4ab95\"]", "cuda"], [[], [["CI", 6], ["CI", 5], ["CI", 4], ["SP", 2, 0, 16, [1, 2, 1, 1], 1], ["SP", 2, 5, 768, [2, 48, 1, 1], 1], ["SP", 2, 10, 768, [16, 4], 1], ["RE", 2, [0, 5, 1, 6, 2, 7, 10, 11, 3, 8, 12, 4, 9]], ["FSP", 7, 0, 3, 3], ["FSP", 7, 4, 4, 3], ["RE", 7, [0, 4, 1, 5, 2, 6, 3, 7]], ["CA", 2, 7, 5], ["CHR", 1, "shared", [2]], ["CA", 2, 3, 6], ["CHR", 0, "shared", [3]], ["CA", 1, 4, 6], ["FU", 9, [0, 1]], ["AN", 9, 0, 5], ["FU", 9, [1, 2]], ["AN", 9, 1, 4], ["FU", 9, [2, 3]], ["AN", 9, 2, 6], ["FU", 1, [0, 1]], ["SP", 1, 0, 64, [32], 1], ["AN", 1, 1, 2], ["FFSP", 1, 0, [4, 3], 1, 1], ["AN", 1, 1, 6], ["FU", 3, [0, 1]], ["SP", 3, 0, 64, [4], 1], ["AN", 3, 1, 2], ["FFSP", 3, 0, [4, 3], 1, 1], ["AN", 3, 1, 6], ["PR", 4, 0, "auto_unroll_max_step$64"]]]], "r": [[4.56138e-05], 0, 2.47516, 1595881309], "v": "v0.2"}
{"i": [["[\"b3656314962f0b9551371fd9acc795db\"]", "cuda"], [[], [["CI", 6], ["CI", 5], ["CI", 4], ["SP", 3, 0, 1, [1, 1, 1, 1], 1], ["SP", 3, 5, 64, [1, 4, 1, 2], 1], ["SP", 3, 10, 64, [1, 8, 1, 1], 1], ["SP", 3, 15, 3, [1, 3, 1, 1], 1], ["SP", 3, 20, 4, [2, 2], 1], ["SP", 3, 23, 4, [1, 4], 1], ["SP", 3, 26, 128, [2, 4], 1], ["RE", 3, [0, 5, 10, 15, 1, 6, 11, 16, 2, 7, 12, 17, 20, 23, 26, 21, 24, 27, 3, 8, 13, 18, 22, 25, 28, 4, 9, 14, 19]], ["FSP", 7, 0, 3, 3], ["FSP", 7, 4, 4, 3], ["FSP", 7, 8, 5, 3], ["FSP", 7, 12, 6, 3], ["RE", 7, [0, 4, 8, 12, 1, 5, 9, 13, 2, 6, 10, 14, 3, 7, 11, 15]], ["CA", 3, 7, 11], ["CHR", 2, "shared", [3]], ["CA", 3, 4, 14], ["CHR", 1, "shared", [4]], ["CA", 2, 5, 14], ["CI", 1], ["FU", 9, [0, 1, 2, 3]], ["AN", 9, 0, 5], ["FU", 9, [1, 2, 3, 4]], ["AN", 9, 1, 4], ["FU", 9, [2, 3, 4, 5]], ["AN", 9, 2, 6], ["FU", 2, [0, 1, 2, 3]], ["SP", 2, 0, 96, [1], 1], ["AN", 2, 1, 2], ["FFSP", 2, 0, [6, 5, 4, 3], 1, 1], ["AN", 2, 1, 6], ["FU", 4, [0, 1, 2, 3]], ["SP", 4, 0, 128, [1], 1], ["AN", 4, 1, 2], ["FFSP", 4, 0, [6, 5, 4, 3], 1, 1], ["AN", 4, 1, 6], ["AN", 5, 27, 1], ["AN", 5, 26, 1], ["AN", 5, 23, 1], ["AN", 5, 22, 1], ["PR", 5, 0, "auto_unroll_max_step$512"]]]], "r": [[1.93122e-05], 0, 2.42867, 1594774306], "v": "v0.2"}
{"i": [["[\"7ff2338874562e7d011be07782898c4a\"]", "cuda"], [[], [["CI", 8], ["CI", 6], ["CI", 4], ["SP", 3, 0, 1, [1, 1, 1, 1], 1], ["SP", 3, 5, 32, [1, 4, 2, 2], 1], ["SP", 3, 10, 32, [1, 16, 2, 1], 1], ["SP", 3, 15, 128, [1, 1, 1, 2], 1], ["SP", 3, 20, 4, [2, 2], 1], ["SP", 3, 23, 4, [4, 1], 1], ["SP", 3, 26, 256, [1, 8], 1], ["RE", 3, [0, 5, 10, 15, 1, 6, 11, 16, 2, 7, 12, 17, 20, 23, 26, 21, 24, 27, 3, 8, 13, 18, 22, 25, 28, 4, 9, 14, 19]], ["FSP", 9, 0, 3, 3], ["FSP", 9, 4, 4, 3], ["FSP", 9, 8, 5, 3], ["FSP", 9, 12, 6, 3], ["RE", 9, [0, 4, 8, 12, 1, 5, 9, 13, 2, 6, 10, 14, 3, 7, 11, 15]], ["CA", 3, 9, 11], ["CHR", 2, "shared", [3]], ["CA", 3, 4, 14], ["CHR", 1, "shared", [4]], ["CA", 2, 5, 14], ["CI", 1], ["FU", 11, [0, 1, 2, 3]], ["AN", 11, 0, 5], ["FU", 11, [1, 2, 3, 4]], ["AN", 11, 1, 4], ["FU", 11, [2, 3, 4, 5]], ["AN", 11, 2, 6], ["FU", 2, [0, 1, 2, 3]], ["SP", 2, 0, 192, [1], 1], ["AN", 2, 1, 2], ["FFSP", 2, 0, [6, 5, 4, 3], 1, 1], ["AN", 2, 1, 6], ["FU", 4, [0, 1, 2, 3]], ["SP", 4, 0, 512, [2], 1], ["AN", 4, 1, 2], ["FFSP", 4, 0, [6, 5, 4, 3], 1, 1], ["AN", 4, 1, 6], ["AN", 5, 27, 1], ["AN", 5, 26, 1], ["AN", 5, 23, 1], ["AN", 5, 22, 1], ["PR", 5, 0, "auto_unroll_max_step$1024"]]]], "r": [[6.6215e-05], 0, 2.84033, 1594771426], "v": "v0.2"}
{"i": [["[\"eb5554180aa620cdc7f58717987f5f27\"]", "cuda"], [[], [["CI", 8], ["CI", 6], ["CI", 4], ["SP", 3, 0, 1, [1, 1, 1, 1], 1], ["SP", 3, 5, 16, [1, 2, 1, 2], 1], ["SP", 3, 10, 16, [1, 8, 2, 1], 1], ["SP", 3, 15, 256, [1, 8, 1, 1], 1], ["SP", 3, 20, 4, [1, 4], 1], ["SP", 3, 23, 4, [2, 2], 1], ["SP", 3, 26, 512, [8, 2], 1], ["RE", 3, [0, 5, 10, 15, 1, 6, 11, 16, 2, 7, 12, 17, 20, 23, 26, 21, 24, 27, 3, 8, 13, 18, 22, 25, 28, 4, 9, 14, 19]], ["FSP", 9, 0, 3, 3], ["FSP", 9, 4, 4, 3], ["FSP", 9, 8, 5, 3], ["FSP", 9, 12, 6, 3], ["RE", 9, [0, 4, 8, 12, 1, 5, 9, 13, 2, 6, 10, 14, 3, 7, 11, 15]], ["CA", 3, 9, 11], ["CHR", 2, "shared", [3]], ["CA", 3, 4, 14], ["CHR", 1, "shared", [4]], ["CA", 2, 5, 14], ["CI", 1], ["FU", 11, [0, 1, 2, 3]], ["AN", 11, 0, 5], ["FU", 11, [1, 2, 3, 4]], ["AN", 11, 1, 4], ["FU", 11, [2, 3, 4, 5]], ["AN", 11, 2, 6], ["FU", 2, [0, 1, 2, 3]], ["SP", 2, 0, 36, [1], 1], ["AN", 2, 1, 2], ["FFSP", 2, 0, [6, 5, 4, 3], 1, 1], ["AN", 2, 1, 6], ["FU", 4, [0, 1, 2, 3]], ["SP", 4, 0, 128, [4], 1], ["AN", 4, 1, 2], ["FFSP", 4, 0, [6, 5, 4, 3], 1, 1], ["AN", 4, 1, 6], ["AN", 5, 27, 1], ["AN", 5, 26, 1], ["AN", 5, 23, 1], ["AN", 5, 22, 1], ["PR", 5, 0, "auto_unroll_max_step$1024"]]]], "r": [[8.23553e-05], 0, 3.16373, 1594778525], "v": "v0.2"}
{"i": [["[\"28e7aea3eea8bada061755d9eb4ebd45\"]", "cuda"], [[], [["CI", 8], ["CI", 6], ["CI", 4], ["SP", 3, 0, 1, [1, 1, 1, 1], 1], ["SP", 3, 5, 8, [1, 4, 2, 1], 1], ["SP", 3, 10, 8, [1, 4, 1, 2], 1], ["SP", 3, 15, 512, [1, 8, 1, 1], 1], ["SP", 3, 20, 4, [1, 4], 1], ["SP", 3, 23, 4, [2, 2], 1], ["SP", 3, 26, 1024, [16, 1], 1], ["RE", 3, [0, 5, 10, 15, 1, 6, 11, 16, 2, 7, 12, 17, 20, 23, 26, 21, 24, 27, 3, 8, 13, 18, 22, 25, 28, 4, 9, 14, 19]], ["FSP", 9, 0, 3, 3], ["FSP", 9, 4, 4, 3], ["FSP", 9, 8, 5, 3], ["FSP", 9, 12, 6, 3], ["RE", 9, [0, 4, 8, 12, 1, 5, 9, 13, 2, 6, 10, 14, 3, 7, 11, 15]], ["CA", 3, 9, 11], ["CHR", 2, "shared", [3]], ["CA", 3, 4, 14], ["CHR", 1, "shared", [4]], ["CA", 2, 5, 14], ["CI", 1], ["FU", 11, [0, 1, 2, 3]], ["AN", 11, 0, 5], ["FU", 11, [1, 2, 3, 4]], ["AN", 11, 1, 4], ["FU", 11, [2, 3, 4, 5]], ["AN", 11, 2, 6], ["FU", 2, [0, 1, 2, 3]], ["SP", 2, 0, 0, [1], 1], ["AN", 2, 1, 2], ["FFSP", 2, 0, [6, 5, 4, 3], 1, 1], ["AN", 2, 1, 6], ["FU", 4, [0, 1, 2, 3]], ["SP", 4, 0, 32, [2], 1], ["AN", 4, 1, 2], ["FFSP", 4, 0, [6, 5, 4, 3], 1, 1], ["AN", 4, 1, 6], ["AN", 5, 27, 1], ["AN", 5, 26, 1], ["AN", 5, 23, 1], ["AN", 5, 22, 1], ["PR", 5, 0, "auto_unroll_max_step$1024"]]]], "r": [[0.000113921], 0, 4.25208, 1594777840], "v": "v0.2"}
{"i": [["[\"b8c945352d98c85a59844321c9cf85c4\"]", "cuda"], [[], [["SP", 2, 0, 1, [1, 1, 1, 1], 1], ["SP", 2, 5, 16384, [1, 32, 1, 1], 1], ["SP", 2, 10, 100, [1, 50], 1], ["RE", 2, [0, 5, 1, 6, 2, 7, 10, 11, 3, 8, 12, 4, 9]], ["FSP", 3, 0, 0, 3], ["FSP", 3, 4, 1, 3], ["RE", 3, [0, 4, 1, 5, 2, 6, 3, 7]], ["CA", 2, 3, 5], ["CHR", 1, "shared", [2]], ["CA", 2, 3, 6], ["CHR", 0, "shared", [3]], ["CA", 1, 4, 6], ["FU", 5, [0, 1]], ["AN", 5, 0, 5], ["FU", 5, [1, 2]], ["AN", 5, 1, 4], ["FU", 5, [2, 3]], ["AN", 5, 2, 6], ["FU", 1, [0, 1]], ["SP", 1, 0, 100, [2], 1], ["AN", 1, 1, 2], ["FFSP", 1, 0, [1, 0], 1, 1], ["AN", 1, 1, 6], ["FU", 3, [0, 1]], ["SP", 3, 0, 100, [2], 1], ["AN", 3, 1, 2], ["FFSP", 3, 0, [1, 0], 1, 1], ["AN", 3, 1, 6], ["PR", 4, 0, "auto_unroll_max_step$0"]]]], "r": [[6.29856e-06], 0, 2.13451, 1594778820], "v": "v0.2"}
{"i": [["[\"0a0dc23e234dddef36170b1a2c7b8738\"]", "cuda"], [[], [["CI", 6], ["CI", 5], ["CI", 4], ["SP", 3, 0, 16, [1, 1, 1, 1], 1], ["SP", 3, 5, 64, [4, 1, 1, 1], 1], ["SP", 3, 10, 64, [1, 16, 2, 2], 1], ["SP", 3, 15, 3, [1, 1, 3, 1], 1], ["SP", 3, 20, 4, [1, 4], 1], ["SP", 3, 23, 4, [2, 2], 1], ["SP", 3, 26, 128, [1, 2], 1], ["RE", 3, [0, 5, 10, 15, 1, 6, 11, 16, 2, 7, 12, 17, 20, 23, 26, 21, 24, 27, 3, 8, 13, 18, 22, 25, 28, 4, 9, 14, 19]], ["FSP", 7, 0, 3, 3], ["FSP", 7, 4, 4, 3], ["FSP", 7, 8, 5, 3], ["FSP", 7, 12, 6, 3], ["RE", 7, [0, 4, 8, 12, 1, 5, 9, 13, 2, 6, 10, 14, 3, 7, 11, 15]], ["CA", 3, 7, 11], ["CHR", 2, "shared", [3]], ["CA", 3, 4, 14], ["CHR", 1, "shared", [4]], ["CA", 2, 5, 14], ["CI", 1], ["FU", 9, [0, 1, 2, 3]], ["AN", 9, 0, 5], ["FU", 9, [1, 2, 3, 4]], ["AN", 9, 1, 4], ["FU", 9, [2, 3, 4, 5]], ["AN", 9, 2, 6], ["FU", 2, [0, 1, 2, 3]], ["SP", 2, 0, 0, [1], 1], ["AN", 2, 1, 2], ["FFSP", 2, 0, [6, 5, 4, 3], 1, 1], ["AN", 2, 1, 6], ["FU", 4, [0, 1, 2, 3]], ["SP", 4, 0, 8, [2], 1], ["AN", 4, 1, 2], ["FFSP", 4, 0, [6, 5, 4, 3], 1, 1], ["AN", 4, 1, 6], ["AN", 5, 27, 1], ["AN", 5, 26, 1], ["AN", 5, 23, 1], ["AN", 5, 22, 1], ["PR", 5, 0, "auto_unroll_max_step$512"]]]], "r": [[7.87961e-05], 0, 2.93775, 1594807112], "v": "v0.2"}
{"i": [["[\"2744c596410e76babe3006def281635b\"]", "cuda"], [[], [["CI", 8], ["CI", 6], ["CI", 4], ["SP", 3, 0, 16, [1, 1, 1, 1], 1], ["SP", 3, 5, 32, [1, 2, 1, 4], 1], ["SP", 3, 10, 32, [1, 8, 1, 4], 1], ["SP", 3, 15, 128, [1, 8, 1, 2], 1], ["SP", 3, 20, 4, [1, 4], 1], ["SP", 3, 23, 4, [1, 4], 1], ["SP", 3, 26, 256, [2, 4], 1], ["RE", 3, [0, 5, 10, 15, 1, 6, 11, 16, 2, 7, 12, 17, 20, 23, 26, 21, 24, 27, 3, 8, 13, 18, 22, 25, 28, 4, 9, 14, 19]], ["FSP", 9, 0, 3, 3], ["FSP", 9, 4, 4, 3], ["FSP", 9, 8, 5, 3], ["FSP", 9, 12, 6, 3], ["RE", 9, [0, 4, 8, 12, 1, 5, 9, 13, 2, 6, 10, 14, 3, 7, 11, 15]], ["CA", 3, 9, 11], ["CHR", 2, "shared", [3]], ["CA", 3, 4, 14], ["CHR", 1, "shared", [4]], ["CA", 2, 5, 14], ["CI", 1], ["FU", 11, [0, 1, 2, 3]], ["AN", 11, 0, 5], ["FU", 11, [1, 2, 3, 4]], ["AN", 11, 1, 4], ["FU", 11, [2, 3, 4, 5]], ["AN", 11, 2, 6], ["FU", 2, [0, 1, 2, 3]], ["SP", 2, 0, 96, [1], 1], ["AN", 2, 1, 2], ["FFSP", 2, 0, [6, 5, 4, 3], 1, 1], ["AN", 2, 1, 6], ["FU", 4, [0, 1, 2, 3]], ["SP", 4, 0, 128, [4], 1], ["AN", 4, 1, 2], ["FFSP", 4, 0, [6, 5, 4, 3], 1, 1], ["AN", 4, 1, 6], ["AN", 5, 27, 1], ["AN", 5, 26, 1], ["AN", 5, 23, 1], ["AN", 5, 22, 1], ["PR", 5, 0, "auto_unroll_max_step$1024"]]]], "r": [[0.000354685], 0, 4.16719, 1594807668], "v": "v0.2"}
{"i": [["[\"ab565177b5fb8fd7320d8075deb0f43d\"]", "cuda"], [[], [["CI", 8], ["CI", 6], ["CI", 4], ["SP", 3, 0, 16, [1, 4, 1, 1], 1], ["SP", 3, 5, 16, [1, 2, 1, 2], 1], ["SP", 3, 10, 16, [2, 1, 1, 8], 1], ["SP", 3, 15, 256, [1, 16, 1, 2], 1], ["SP", 3, 20, 4, [1, 4], 1], ["SP", 3, 23, 4, [1, 4], 1], ["SP", 3, 26, 512, [4, 2], 1], ["RE", 3, [0, 5, 10, 15, 1, 6, 11, 16, 2, 7, 12, 17, 20, 23, 26, 21, 24, 27, 3, 8, 13, 18, 22, 25, 28, 4, 9, 14, 19]], ["FSP", 9, 0, 3, 3], ["FSP", 9, 4, 4, 3], ["FSP", 9, 8, 5, 3], ["FSP", 9, 12, 6, 3], ["RE", 9, [0, 4, 8, 12, 1, 5, 9, 13, 2, 6, 10, 14, 3, 7, 11, 15]], ["CA", 3, 9, 11], ["CHR", 2, "shared", [3]], ["CA", 3, 4, 14], ["CHR", 1, "shared", [4]], ["CA", 2, 5, 14], ["CI", 1], ["FU", 11, [0, 1, 2, 3]], ["AN", 11, 0, 5], ["FU", 11, [1, 2, 3, 4]], ["AN", 11, 1, 4], ["FU", 11, [2, 3, 4, 5]], ["AN", 11, 2, 6], ["FU", 2, [0, 1, 2, 3]], ["SP", 2, 0, 144, [1], 1], ["AN", 2, 1, 2], ["FFSP", 2, 0, [6, 5, 4, 3], 1, 1], ["AN", 2, 1, 6], ["FU", 4, [0, 1, 2, 3]], ["SP", 4, 0, 2048, [4], 1], ["AN", 4, 1, 2], ["FFSP", 4, 0, [6, 5, 4, 3], 1, 1], ["AN", 4, 1, 6], ["AN", 5, 27, 1], ["AN", 5, 26, 1], ["AN", 5, 23, 1], ["AN", 5, 22, 1], ["PR", 5, 0, "auto_unroll_max_step$1024"]]]], "r": [[0.000395609], 0, 3.95376, 1594800659], "v": "v0.2"}
{"i": [["[\"d7741cc1c301228b3f076a461cec0650\"]", "cuda"], [[], [["CI", 8], ["CI", 6], ["CI", 4], ["SP", 3, 0, 16, [1, 1, 1, 1], 1], ["SP", 3, 5, 8, [1, 1, 1, 8], 1], ["SP", 3, 10, 8, [2, 2, 1, 2], 1], ["SP", 3, 15, 512, [1, 64, 1, 1], 1], ["SP", 3, 20, 4, [1, 4], 1], ["SP", 3, 23, 4, [1, 4], 1], ["SP", 3, 26, 1024, [1, 4], 1], ["RE", 3, [0, 5, 10, 15, 1, 6, 11, 16, 2, 7, 12, 17, 20, 23, 26, 21, 24, 27, 3, 8, 13, 18, 22, 25, 28, 4, 9, 14, 19]], ["FSP", 9, 0, 3, 3], ["FSP", 9, 4, 4, 3], ["FSP", 9, 8, 5, 3], ["FSP", 9, 12, 6, 3], ["RE", 9, [0, 4, 8, 12, 1, 5, 9, 13, 2, 6, 10, 14, 3, 7, 11, 15]], ["CA", 3, 9, 11], ["CHR", 2, "shared", [3]], ["CA", 3, 4, 14], ["CHR", 1, "shared", [4]], ["CA", 2, 5, 14], ["CI", 1], ["FU", 11, [0, 1, 2, 3]], ["AN", 11, 0, 5], ["FU", 11, [1, 2, 3, 4]], ["AN", 11, 1, 4], ["FU", 11, [2, 3, 4, 5]], ["AN", 11, 2, 6], ["FU", 2, [0, 1, 2, 3]], ["SP", 2, 0, 40, [1], 1], ["AN", 2, 1, 2], ["FFSP", 2, 0, [6, 5, 4, 3], 1, 1], ["AN", 2, 1, 6], ["FU", 4, [0, 1, 2, 3]], ["SP", 4, 0, 4, [2], 1], ["AN", 4, 1, 2], ["FFSP", 4, 0, [6, 5, 4, 3], 1, 1], ["AN", 4, 1, 6], ["AN", 5, 27, 1], ["AN", 5, 26, 1], ["AN", 5, 23, 1], ["AN", 5, 22, 1], ["PR", 5, 0, "auto_unroll_max_step$64"]]]], "r": [[0.000445826], 0, 4.13703, 1594791705], "v": "v0.2"}
{"i": [["[\"468224bdb6800882e7755cf05f402b44\"]", "cuda"], [[], [["SP", 2, 0, 16, [2, 1, 2, 4], 1], ["SP", 2, 5, 16384, [1, 64, 1, 1], 1], ["SP", 2, 10, 100, [5, 10], 1], ["RE", 2, [0, 5, 1, 6, 2, 7, 10, 11, 3, 8, 12, 4, 9]], ["FSP", 3, 0, 0, 3], ["FSP", 3, 4, 1, 3], ["RE", 3, [0, 4, 1, 5, 2, 6, 3, 7]], ["CA", 2, 3, 5], ["CHR", 1, "shared", [2]], ["CA", 2, 3, 6], ["CHR", 0, "shared", [3]], ["CA", 1, 4, 6], ["FU", 5, [0, 1]], ["AN", 5, 0, 5], ["FU", 5, [1, 2]], ["AN", 5, 1, 4], ["FU", 5, [2, 3]], ["AN", 5, 2, 6], ["FU", 1, [0, 1]], ["SP", 1, 0, 80, [5], 1], ["AN", 1, 1, 2], ["FFSP", 1, 0, [1, 0], 1, 1], ["AN", 1, 1, 6], ["FU", 3, [0, 1]], ["SP", 3, 0, 40, [2], 1], ["AN", 3, 1, 2], ["FFSP", 3, 0, [1, 0], 1, 1], ["AN", 3, 1, 6], ["PR", 4, 0, "auto_unroll_max_step$512"]]]], "r": [[1.43598e-05], 0, 2.78149, 1594808408], "v": "v0.2"}
{"i": [["[\"cb485a4f97b7a4c50d5df7bdd445bf03\"]", "cuda"], [[], [["SP", 4, 1, 1000, [50], 1], ["AN", 4, 2, 6], ["FSP", 3, 1, 0, 1], ["AN", 3, 2, 6], ["CA", 3, 4, 0], ["CI", 2], ["FSP", 1, 1, 0, 1], ["AN", 1, 2, 6], ["CA", 1, 4, 0], ["AN", 1, 0, 5], ["AN", 3, 0, 5], ["AN", 4, 0, 5]]]], "r": [[4.89159e-06], 0, 2.00282, 1595890998], "v": "v0.2"}
{"i": [["[\"1abb86dddda18d306c71404a526eba9e\"]", "cuda"], [[], [["SP", 4, 1, 1000, [32], 1], ["AN", 4, 2, 6], ["FSP", 2, 2, 0, 1], ["AN", 2, 3, 6], ["CA", 2, 4, 1], ["FU", 2, [0, 1]], ["AN", 2, 0, 5], ["FU", 4, [0, 1]], ["AN", 4, 0, 5], ["PR", 2, 0, "auto_unroll_max_step$1024"]]]], "r": [[3.5563e-06], 0, 2.30579, 1597546732], "v": "v0.2"}
{"i": [["[\"2e210f3e459611af06107044774080df\"]", "cuda"], [[], [["FU", 1, [0, 1, 2, 3]], ["SP", 1, 0, 2048, [4], 1], ["AN", 1, 0, 5], ["AN", 1, 1, 6], ["FU", 2, [0, 1, 2, 3]], ["SP", 2, 0, 2048, [4], 1], ["AN", 2, 0, 5], ["AN", 2, 1, 6]]]], "r": [[5.55783e-06], 0, 1.39181, 1597546759], "v": "v0.2"}
{"i": [["[\"7aa900a12c305d89e8f099af9ab12592\"]", "cuda"], [[], [["CI", 9], ["CI", 7], ["CI", 5], ["SP", 3, 0, 1, [1, 1, 1, 1], 1], ["SP", 3, 5, 7, [1, 7, 1, 1], 1], ["SP", 3, 10, 7, [7, 1, 1, 1], 1], ["SP", 3, 15, 2048, [1, 32, 1, 1], 1], ["SP", 3, 20, 1, [1, 1], 1], ["SP", 3, 23, 1, [1, 1], 1], ["SP", 3, 26, 512, [32, 2], 1], ["RE", 3, [0, 5, 10, 15, 1, 6, 11, 16, 2, 7, 12, 17, 20, 23, 26, 21, 24, 27, 3, 8, 13, 18, 22, 25, 28, 4, 9, 14, 19]], ["FSP", 10, 0, 3, 3], ["FSP", 10, 4, 4, 3], ["FSP", 10, 8, 5, 3], ["FSP", 10, 12, 6, 3], ["RE", 10, [0, 4, 8, 12, 1, 5, 9, 13, 2, 6, 10, 14, 3, 7, 11, 15]], ["CA", 3, 10, 11], ["CHR", 2, "shared", [3]], ["CA", 3, 4, 14], ["CHR", 1, "shared", [4]], ["CA", 2, 5, 14], ["CI", 1], ["FU", 2, [0, 1, 2, 3]], ["SP", 2, 0, 16, [2], 1], ["AN", 2, 1, 2], ["FFSP", 2, 0, [6, 5, 4, 3], 1, 1], ["AN", 2, 1, 6], ["FU", 4, [0, 1, 2, 3]], ["SP", 4, 0, 16, [2], 1], ["AN", 4, 1, 2], ["FFSP", 4, 0, [6, 5, 4, 3], 1, 1], ["AN", 4, 1, 6], ["FU", 12, [0, 1, 2, 3]], ["AN", 12, 0, 5], ["FU", 12, [1, 2, 3, 4]], ["AN", 12, 1, 4], ["FU", 12, [2, 3, 4, 5]], ["AN", 12, 2, 6], ["PR", 5, 0, "auto_unroll_max_step$512"]]]], "r": [[2.10302e-05], 0, 2.59377, 1597605020], "v": "v0.2"}
{"i": [["[\"32b76d0047e112bcc9a4c3086fc9b3ec\"]", "cuda"], [[], [["CI", 11], ["CI", 9], ["AN", 8, 0, 1], ["AN", 8, 1, 1], ["SP", 8, 2, 16, [1], 1], ["SP", 8, 4, 512, [64], 1], ["AN", 8, 6, 1], ["AN", 8, 7, 1], ["RE", 8, [2, 4, 3, 5, 0, 1, 6, 7]], ["CI", 7], ["CHW", 6, "local"], ["SP", 6, 0, 4, [1, 1, 1, 1], 1], ["SP", 6, 5, 4, [1, 1, 1, 1], 1], ["SP", 6, 10, 16, [1, 2, 4, 2], 1], ["SP", 6, 15, 512, [1, 32, 1, 1], 1], ["SP", 6, 20, 512, [2, 8], 1], ["RE", 6, [0, 5, 10, 15, 1, 6, 11, 16, 2, 7, 12, 17, 20, 21, 3, 8, 13, 18, 22, 4, 9, 14, 19]], ["FSP", 7, 0, 11, 3], ["FSP", 7, 4, 12, 3], ["FSP", 7, 8, 13, 3], ["FSP", 7, 12, 14, 3], ["RE", 7, [0, 4, 8, 12, 1, 5, 9, 13, 2, 6, 10, 14, 3, 7, 11, 15]], ["CA", 6, 7, 11], ["CHR", 5, "shared", [6]], ["CA", 6, 7, 12], ["CHR", 4, "shared", [7]], ["CA", 5, 8, 12], ["AN", 4, 0, 1], ["AN", 4, 1, 1], ["SP", 4, 2, 16, [2], 1], ["SP", 4, 4, 512, [16], 1], ["AN", 4, 6, 1], ["AN", 4, 7, 1], ["RE", 4, [2, 4, 3, 5, 0, 1, 6, 7]], ["CI", 3], ["CA", 2, 4, 3], ["CI", 1], ["FU", 4, [0, 1, 2, 3]], ["SP", 4, 0, 8192, [64], 1], ["AN", 4, 0, 5], ["AN", 4, 1, 6], ["FU", 5, [0, 1, 2, 3]], ["SP", 5, 0, 128, [1], 1], ["AN", 5, 1, 2], ["FFSP", 5, 0, [14, 13, 12, 11], 1, 1], ["AN", 5, 1, 6], ["FU", 7, [0, 1, 2, 3]], ["SP", 7, 0, 32, [4], 1], ["AN", 7, 1, 2], ["FFSP", 7, 0, [14, 13, 12, 11], 1, 1], ["AN", 7, 1, 6], ["FU", 9, [0, 1, 2, 3]], ["AN", 9, 0, 5], ["FU", 9, [1, 2, 3, 4]], ["AN", 9, 1, 4], ["FU", 9, [2, 3, 4, 5]], ["AN", 9, 2, 6], ["FU", 11, [0, 1, 2, 3]], ["SP", 11, 0, 8192, [64], 1], ["AN", 11, 0, 5], ["AN", 11, 1, 6], ["FU", 15, [0, 1, 2, 3]], ["SP", 15, 0, 25088, [56], 1], ["AN", 15, 0, 5], ["AN", 15, 1, 6], ["PR", 8, 0, "auto_unroll_max_step$1024"]]]], "r": [[4.98802e-05], 0, 3.27041, 1597663993], "v": "v0.2"}
{"i": [["[\"ac2c615e89d7e7840b702032efd7b02a\"]", "cuda"], [[], [["CI", 5], ["SP", 3, 0, 1, [1, 1, 1, 1], 1], ["SP", 3, 5, 7, [1, 7, 1, 1], 1], ["SP", 3, 10, 7, [1, 1, 1, 1], 1], ["SP", 3, 15, 512, [1, 16, 1, 1], 1], ["SP", 3, 20, 1, [1, 1], 1], ["SP", 3, 23, 1, [1, 1], 1], ["SP", 3, 26, 2048, [128, 1], 1], ["RE", 3, [0, 5, 10, 15, 1, 6, 11, 16, 2, 7, 12, 17, 20, 23, 26, 21, 24, 27, 3, 8, 13, 18, 22, 25, 28, 4, 9, 14, 19]], ["FSP", 6, 0, 1, 3], ["FSP", 6, 4, 2, 3], ["FSP", 6, 8, 3, 3], ["FSP", 6, 12, 4, 3], ["RE", 6, [0, 4, 8, 12, 1, 5, 9, 13, 2, 6, 10, 14, 3, 7, 11, 15]], ["CA", 3, 6, 11], ["CHR", 2, "shared", [3]], ["CA", 3, 4, 14], ["CHR", 1, "shared", [4]], ["CA", 2, 5, 14], ["CI", 1], ["FU", 2, [0, 1, 2, 3]], ["SP", 2, 0, 64, [2], 1], ["AN", 2, 1, 2], ["FFSP", 2, 0, [4, 3, 2, 1], 1, 1], ["AN", 2, 1, 6], ["FU", 4, [0, 1, 2, 3]], ["SP", 4, 0, 64, [1], 1], ["AN", 4, 1, 2], ["FFSP", 4, 0, [4, 3, 2, 1], 1, 1], ["AN", 4, 1, 6], ["FU", 8, [0, 1, 2, 3]], ["AN", 8, 0, 5], ["FU", 8, [1, 2, 3, 4]], ["AN", 8, 1, 4], ["FU", 8, [2, 3, 4, 5]], ["AN", 8, 2, 6], ["PR", 5, 0, "auto_unroll_max_step$512"]]]], "r": [[4.09148e-05], 0, 2.00499, 1597570336], "v": "v0.2"}
{"i": [["[\"50b52a6a2861ddbd7d7631836723cc46\"]", "cuda"], [[], [["SP", 3, 0, 1, [1, 1, 1, 1], 1], ["SP", 3, 5, 7, [1, 7, 1, 1], 1], ["SP", 3, 10, 7, [7, 1, 1, 1], 1], ["SP", 3, 15, 2048, [1, 32, 1, 1], 1], ["SP", 3, 20, 1, [1, 1], 1], ["SP", 3, 23, 1, [1, 1], 1], ["SP", 3, 26, 512, [16, 4], 1], ["RE", 3, [0, 5, 10, 15, 1, 6, 11, 16, 2, 7, 12, 17, 20, 23, 26, 21, 24, 27, 3, 8, 13, 18, 22, 25, 28, 4, 9, 14, 19]], ["FSP", 5, 0, 0, 3], ["FSP", 5, 4, 1, 3], ["FSP", 5, 8, 2, 3], ["FSP", 5, 12, 3, 3], ["RE", 5, [0, 4, 8, 12, 1, 5, 9, 13, 2, 6, 10, 14, 3, 7, 11, 15]], ["CA", 3, 5, 11], ["CHR", 2, "shared", [3]], ["CA", 3, 4, 14], ["CHR", 1, "shared", [4]], ["CA", 2, 5, 14], ["CI", 1], ["FU", 2, [0, 1, 2, 3]], ["SP", 2, 0, 224, [2], 1], ["AN", 2, 1, 2], ["FFSP", 2, 0, [3, 2, 1, 0], 1, 1], ["AN", 2, 1, 6], ["FU", 4, [0, 1, 2, 3]], ["SP", 4, 0, 64, [2], 1], ["AN", 4, 1, 2], ["FFSP", 4, 0, [3, 2, 1, 0], 1, 1], ["AN", 4, 1, 6], ["FU", 7, [0, 1, 2, 3]], ["AN", 7, 0, 5], ["FU", 7, [1, 2, 3, 4]], ["AN", 7, 1, 4], ["FU", 7, [2, 3, 4, 5]], ["AN", 7, 2, 6], ["PR", 5, 0, "auto_unroll_max_step$512"]]]], "r": [[2.08212e-05], 0, 2.5529, 1597596459], "v": "v0.2"}
{"i": [["[\"313b3d04437bd434dd092dd0d3e6149f\"]", "cuda"], [[], [["CI", 5], ["SP", 3, 0, 1, [1, 1, 1, 1], 1], ["SP", 3, 5, 7, [1, 1, 1, 1], 1], ["SP", 3, 10, 7, [1, 7, 1, 1], 1], ["SP", 3, 15, 512, [1, 16, 1, 1], 1], ["SP", 3, 20, 1, [1, 1], 1], ["SP", 3, 23, 1, [1, 1], 1], ["SP", 3, 26, 1024, [4, 32], 1], ["RE", 3, [0, 5, 10, 15, 1, 6, 11, 16, 2, 7, 12, 17, 20, 23, 26, 21, 24, 27, 3, 8, 13, 18, 22, 25, 28, 4, 9, 14, 19]], ["FSP", 6, 0, 1, 3], ["FSP", 6, 4, 2, 3], ["FSP", 6, 8, 3, 3], ["FSP", 6, 12, 4, 3], ["RE", 6, [0, 4, 8, 12, 1, 5, 9, 13, 2, 6, 10, 14, 3, 7, 11, 15]], ["CA", 3, 6, 11], ["CHR", 2, "shared", [3]], ["CA", 3, 4, 14], ["CHR", 1, "shared", [4]], ["CA", 2, 5, 14], ["CI", 1], ["FU", 2, [0, 1, 2, 3]], ["SP", 2, 0, 16, [1], 1], ["AN", 2, 1, 2], ["FFSP", 2, 0, [4, 3, 2, 1], 1, 1], ["AN", 2, 1, 6], ["FU", 4, [0, 1, 2, 3]], ["SP", 4, 0, 64, [1], 1], ["AN", 4, 1, 2], ["FFSP", 4, 0, [4, 3, 2, 1], 1, 1], ["AN", 4, 1, 6], ["FU", 8, [0, 1, 2, 3]], ["AN", 8, 0, 5], ["FU", 8, [1, 2, 3, 4]], ["AN", 8, 1, 4], ["FU", 8, [2, 3, 4, 5]], ["AN", 8, 2, 6], ["PR", 5, 0, "auto_unroll_max_step$64"]]]], "r": [[2.41821e-05], 0, 1.95041, 1597605452], "v": "v0.2"}
{"i": [["[\"42117ca89431938c408b83197946f5f3\"]", "cuda"], [[], [["CI", 7], ["CI", 5], ["SP", 3, 0, 1, [1, 1, 1, 1], 1], ["SP", 3, 5, 14, [1, 2, 1, 7], 1], ["SP", 3, 10, 14, [1, 1, 1, 1], 1], ["SP", 3, 15, 1024, [1, 64, 1, 1], 1], ["SP", 3, 20, 1, [1, 1], 1], ["SP", 3, 23, 1, [1, 1], 1], ["SP", 3, 26, 256, [4, 16], 1], ["RE", 3, [0, 5, 10, 15, 1, 6, 11, 16, 2, 7, 12, 17, 20, 23, 26, 21, 24, 27, 3, 8, 13, 18, 22, 25, 28, 4, 9, 14, 19]], ["FSP", 8, 0, 2, 3], ["FSP", 8, 4, 3, 3], ["FSP", 8, 8, 4, 3], ["FSP", 8, 12, 5, 3], ["RE", 8, [0, 4, 8, 12, 1, 5, 9, 13, 2, 6, 10, 14, 3, 7, 11, 15]], ["CA", 3, 8, 11], ["CHR", 2, "shared", [3]], ["CA", 3, 4, 14], ["CHR", 1, "shared", [4]], ["CA", 2, 5, 14], ["CI", 1], ["FU", 2, [0, 1, 2, 3]], ["SP", 2, 0, 16, [1], 1], ["AN", 2, 1, 2], ["FFSP", 2, 0, [5, 4, 3, 2], 1, 1], ["AN", 2, 1, 6], ["FU", 4, [0, 1, 2, 3]], ["SP", 4, 0, 32, [2], 1], ["AN", 4, 1, 2], ["FFSP", 4, 0, [5, 4, 3, 2], 1, 1], ["AN", 4, 1, 6], ["FU", 10, [0, 1, 2, 3]], ["AN", 10, 0, 5], ["FU", 10, [1, 2, 3, 4]], ["AN", 10, 1, 4], ["FU", 10, [2, 3, 4, 5]], ["AN", 10, 2, 6], ["PR", 5, 0, "auto_unroll_max_step$16"]]]], "r": [[1.56005e-05], 0, 2.59053, 1597651777], "v": "v0.2"}
{"i": [["[\"0681f065b0ec98c902169dfc0f881430\"]", "cuda"], [[], [["CI", 11], ["CI", 9], ["AN", 8, 0, 1], ["AN", 8, 1, 1], ["SP", 8, 2, 49, [1], 1], ["SP", 8, 4, 256, [16], 1], ["AN", 8, 6, 1], ["AN", 8, 7, 1], ["RE", 8, [2, 4, 3, 5, 0, 1, 6, 7]], ["CI", 7], ["CHW", 6, "local"], ["SP", 6, 0, 4, [1, 1, 1, 1], 1], ["SP", 6, 5, 4, [1, 1, 1, 1], 1], ["SP", 6, 10, 49, [1, 7, 1, 7], 1], ["SP", 6, 15, 256, [2, 16, 1, 1], 1], ["SP", 6, 20, 256, [4, 4], 1], ["RE", 6, [0, 5, 10, 15, 1, 6, 11, 16, 2, 7, 12, 17, 20, 21, 3, 8, 13, 18, 22, 4, 9, 14, 19]], ["FSP", 7, 0, 11, 3], ["FSP", 7, 4, 12, 3], ["FSP", 7, 8, 13, 3], ["FSP", 7, 12, 14, 3], ["RE", 7, [0, 4, 8, 12, 1, 5, 9, 13, 2, 6, 10, 14, 3, 7, 11, 15]], ["CA", 6, 7, 11], ["CHR", 5, "shared", [6]], ["CA", 6, 7, 12], ["CHR", 4, "shared", [7]], ["CA", 5, 8, 12], ["AN", 4, 0, 1], ["AN", 4, 1, 1], ["SP", 4, 2, 49, [1], 1], ["SP", 4, 4, 256, [64], 1], ["AN", 4, 6, 1], ["AN", 4, 7, 1], ["RE", 4, [2, 4, 3, 5, 0, 1, 6, 7]], ["CI", 3], ["CA", 2, 4, 3], ["CI", 1], ["FU", 4, [0, 1, 2, 3]], ["SP", 4, 0, 12544, [56], 1], ["AN", 4, 0, 5], ["AN", 4, 1, 6], ["FU", 5, [0, 1, 2, 3]], ["SP", 5, 0, 8, [1], 1], ["AN", 5, 1, 2], ["FFSP", 5, 0, [14, 13, 12, 11], 1, 1], ["AN", 5, 1, 6], ["FU", 7, [0, 1, 2, 3]], ["SP", 7, 0, 8, [1], 1], ["AN", 7, 1, 2], ["FFSP", 7, 0, [14, 13, 12, 11], 1, 1], ["AN", 7, 1, 6], ["FU", 9, [0, 1, 2, 3]], ["AN", 9, 0, 5], ["FU", 9, [1, 2, 3, 4]], ["AN", 9, 1, 4], ["FU", 9, [2, 3, 4, 5]], ["AN", 9, 2, 6], ["FU", 11, [0, 1, 2, 3]], ["SP", 11, 0, 12544, [56], 1], ["AN", 11, 0, 5], ["AN", 11, 1, 6], ["FU", 15, [0, 1, 2, 3]], ["SP", 15, 0, 50176, [64], 1], ["AN", 15, 0, 5], ["AN", 15, 1, 6], ["PR", 8, 0, "auto_unroll_max_step$1024"]]]], "r": [[3.18225e-05], 0, 2.56749, 1597656399], "v": "v0.2"}
{"i": [["[\"60b74e07b25e777d8ac200ea00b511aa\"]", "cuda"], [[], [["CI", 5], ["SP", 3, 0, 1, [1, 1, 1, 1], 1], ["SP", 3, 5, 14, [1, 1, 2, 1], 1], ["SP", 3, 10, 14, [1, 14, 1, 1], 1], ["SP", 3, 15, 256, [1, 16, 2, 1], 1], ["SP", 3, 20, 1, [1, 1], 1], ["SP", 3, 23, 1, [1, 1], 1], ["SP", 3, 26, 1024, [4, 32], 1], ["RE", 3, [0, 5, 10, 15, 1, 6, 11, 16, 2, 7, 12, 17, 20, 23, 26, 21, 24, 27, 3, 8, 13, 18, 22, 25, 28, 4, 9, 14, 19]], ["FSP", 6, 0, 1, 3], ["FSP", 6, 4, 2, 3], ["FSP", 6, 8, 3, 3], ["FSP", 6, 12, 4, 3], ["RE", 6, [0, 4, 8, 12, 1, 5, 9, 13, 2, 6, 10, 14, 3, 7, 11, 15]], ["CA", 3, 6, 11], ["CHR", 2, "shared", [3]], ["CA", 3, 4, 14], ["CHR", 1, "shared", [4]], ["CA", 2, 5, 14], ["CI", 1], ["FU", 2, [0, 1, 2, 3]], ["SP", 2, 0, 64, [4], 1], ["AN", 2, 1, 2], ["FFSP", 2, 0, [4, 3, 2, 1], 1, 1], ["AN", 2, 1, 6], ["FU", 4, [0, 1, 2, 3]], ["SP", 4, 0, 64, [1], 1], ["AN", 4, 1, 2], ["FFSP", 4, 0, [4, 3, 2, 1], 1, 1], ["AN", 4, 1, 6], ["FU", 8, [0, 1, 2, 3]], ["AN", 8, 0, 5], ["FU", 8, [1, 2, 3, 4]], ["AN", 8, 1, 4], ["FU", 8, [2, 3, 4, 5]], ["AN", 8, 2, 6], ["PR", 5, 0, "auto_unroll_max_step$512"]]]], "r": [[2.47347e-05], 0, 2.76334, 1597649517], "v": "v0.2"}
{"i": [["[\"e90ef6f78235bb414c215b081ecaabc7\"]", "cuda"], [[], [["SP", 3, 0, 1, [1, 1, 1, 1], 1], ["SP", 3, 5, 14, [7, 2, 1, 1], 1], ["SP", 3, 10, 14, [1, 2, 1, 1], 1], ["SP", 3, 15, 1024, [1, 32, 1, 1], 1], ["SP", 3, 20, 1, [1, 1], 1], ["SP", 3, 23, 1, [1, 1], 1], ["SP", 3, 26, 256, [8, 8], 1], ["RE", 3, [0, 5, 10, 15, 1, 6, 11, 16, 2, 7, 12, 17, 20, 23, 26, 21, 24, 27, 3, 8, 13, 18, 22, 25, 28, 4, 9, 14, 19]], ["FSP", 5, 0, 0, 3], ["FSP", 5, 4, 1, 3], ["FSP", 5, 8, 2, 3], ["FSP", 5, 12, 3, 3], ["RE", 5, [0, 4, 8, 12, 1, 5, 9, 13, 2, 6, 10, 14, 3, 7, 11, 15]], ["CA", 3, 5, 11], ["CHR", 2, "shared", [3]], ["CA", 3, 4, 14], ["CHR", 1, "shared", [4]], ["CA", 2, 5, 14], ["CI", 1], ["FU", 2, [0, 1, 2, 3]], ["SP", 2, 0, 8, [2], 1], ["AN", 2, 1, 2], ["FFSP", 2, 0, [3, 2, 1, 0], 1, 1], ["AN", 2, 1, 6], ["FU", 4, [0, 1, 2, 3]], ["SP", 4, 0, 8, [2], 1], ["AN", 4, 1, 2], ["FFSP", 4, 0, [3, 2, 1, 0], 1, 1], ["AN", 4, 1, 6], ["FU", 7, [0, 1, 2, 3]], ["AN", 7, 0, 5], ["FU", 7, [1, 2, 3, 4]], ["AN", 7, 1, 4], ["FU", 7, [2, 3, 4, 5]], ["AN", 7, 2, 6], ["PR", 5, 0, "auto_unroll_max_step$512"]]]], "r": [[1.53487e-05], 0, 3.20733, 1597638839], "v": "v0.2"}
{"i": [["[\"f2b7a18e6b007434a888c903cf4818be\"]", "cuda"], [[], [["CI", 5], ["SP", 3, 0, 1, [1, 1, 1, 1], 1], ["SP", 3, 5, 14, [2, 1, 1, 1], 1], ["SP", 3, 10, 14, [1, 2, 1, 1], 1], ["SP", 3, 15, 256, [1, 32, 1, 1], 1], ["SP", 3, 20, 1, [1, 1], 1], ["SP", 3, 23, 1, [1, 1], 1], ["SP", 3, 26, 512, [1, 64], 1], ["RE", 3, [0, 5, 10, 15, 1, 6, 11, 16, 2, 7, 12, 17, 20, 23, 26, 21, 24, 27, 3, 8, 13, 18, 22, 25, 28, 4, 9, 14, 19]], ["FSP", 6, 0, 1, 3], ["FSP", 6, 4, 2, 3], ["FSP", 6, 8, 3, 3], ["FSP", 6, 12, 4, 3], ["RE", 6, [0, 4, 8, 12, 1, 5, 9, 13, 2, 6, 10, 14, 3, 7, 11, 15]], ["CA", 3, 6, 11], ["CHR", 2, "shared", [3]], ["CA", 3, 4, 14], ["CHR", 1, "shared", [4]], ["CA", 2, 5, 14], ["CI", 1], ["FU", 2, [0, 1, 2, 3]], ["SP", 2, 0, 24, [3], 1], ["AN", 2, 1, 2], ["FFSP", 2, 0, [4, 3, 2, 1], 1, 1], ["AN", 2, 1, 6], ["FU", 4, [0, 1, 2, 3]], ["SP", 4, 0, 16, [4], 1], ["AN", 4, 1, 2], ["FFSP", 4, 0, [4, 3, 2, 1], 1, 1], ["AN", 4, 1, 6], ["FU", 8, [0, 1, 2, 3]], ["AN", 8, 0, 5], ["FU", 8, [1, 2, 3, 4]], ["AN", 8, 1, 4], ["FU", 8, [2, 3, 4, 5]], ["AN", 8, 2, 6], ["PR", 5, 0, "auto_unroll_max_step$1024"]]]], "r": [[1.62834e-05], 0, 2.4787, 1597624693], "v": "v0.2"}
{"i": [["[\"c0cb763b7d2ed7d0e76ca9a76f749566\"]", "cuda"], [[], [["CI", 7], ["CI", 5], ["SP", 3, 0, 1, [1, 1, 1, 1], 1], ["SP", 3, 5, 28, [1, 1, 4, 1], 1], ["SP", 3, 10, 28, [1, 4, 1, 1], 1], ["SP", 3, 15, 512, [1, 32, 2, 1], 1], ["SP", 3, 20, 1, [1, 1], 1], ["SP", 3, 23, 1, [1, 1], 1], ["SP", 3, 26, 128, [1, 16], 1], ["RE", 3, [0, 5, 10, 15, 1, 6, 11, 16, 2, 7, 12, 17, 20, 23, 26, 21, 24, 27, 3, 8, 13, 18, 22, 25, 28, 4, 9, 14, 19]], ["FSP", 8, 0, 2, 3], ["FSP", 8, 4, 3, 3], ["FSP", 8, 8, 4, 3], ["FSP", 8, 12, 5, 3], ["RE", 8, [0, 4, 8, 12, 1, 5, 9, 13, 2, 6, 10, 14, 3, 7, 11, 15]], ["CA", 3, 8, 11], ["CHR", 2, "shared", [3]], ["CA", 3, 4, 14], ["CHR", 1, "shared", [4]], ["CA", 2, 5, 14], ["CI", 1], ["FU", 2, [0, 1, 2, 3]], ["SP", 2, 0, 8, [1], 1], ["AN", 2, 1, 2], ["FFSP", 2, 0, [5, 4, 3, 2], 1, 1], ["AN", 2, 1, 6], ["FU", 4, [0, 1, 2, 3]], ["SP", 4, 0, 16, [4], 1], ["AN", 4, 1, 2], ["FFSP", 4, 0, [5, 4, 3, 2], 1, 1], ["AN", 4, 1, 6], ["FU", 10, [0, 1, 2, 3]], ["AN", 10, 0, 5], ["FU", 10, [1, 2, 3, 4]], ["AN", 10, 1, 4], ["FU", 10, [2, 3, 4, 5]], ["AN", 10, 2, 6], ["PR", 5, 0, "auto_unroll_max_step$64"]]]], "r": [[1.47914e-05], 0, 2.59241, 1597624045], "v": "v0.2"}
{"i": [["[\"a0fcd2b59362351fbe9d01be27ec63bf\"]", "cuda"], [[], [["CI", 11], ["CI", 9], ["AN", 8, 0, 1], ["AN", 8, 1, 1], ["SP", 8, 2, 196, [1], 1], ["SP", 8, 4, 128, [16], 1], ["AN", 8, 6, 1], ["AN", 8, 7, 1], ["RE", 8, [2, 4, 3, 5, 0, 1, 6, 7]], ["CI", 7], ["CHW", 6, "local"], ["SP", 6, 0, 4, [1, 1, 1, 1], 1], ["SP", 6, 5, 4, [1, 1, 1, 1], 1], ["SP", 6, 10, 196, [1, 4, 1, 7], 1], ["SP", 6, 15, 128, [2, 32, 1, 1], 1], ["SP", 6, 20, 128, [8, 1], 1], ["RE", 6, [0, 5, 10, 15, 1, 6, 11, 16, 2, 7, 12, 17, 20, 21, 3, 8, 13, 18, 22, 4, 9, 14, 19]], ["FSP", 7, 0, 11, 3], ["FSP", 7, 4, 12, 3], ["FSP", 7, 8, 13, 3], ["FSP", 7, 12, 14, 3], ["RE", 7, [0, 4, 8, 12, 1, 5, 9, 13, 2, 6, 10, 14, 3, 7, 11, 15]], ["CA", 6, 7, 11], ["CHR", 5, "shared", [6]], ["CA", 6, 7, 12], ["CHR", 4, "shared", [7]], ["CA", 5, 8, 12], ["AN", 4, 0, 1], ["AN", 4, 1, 1], ["SP", 4, 2, 196, [14], 1], ["SP", 4, 4, 128, [64], 1], ["AN", 4, 6, 1], ["AN", 4, 7, 1], ["RE", 4, [2, 4, 3, 5, 0, 1, 6, 7]], ["CI", 3], ["CA", 2, 4, 3], ["CI", 1], ["FU", 4, [0, 1, 2, 3]], ["SP", 4, 0, 25088, [64], 1], ["AN", 4, 0, 5], ["AN", 4, 1, 6], ["FU", 5, [0, 1, 2, 3]], ["SP", 5, 0, 56, [1], 1], ["AN", 5, 1, 2], ["FFSP", 5, 0, [14, 13, 12, 11], 1, 1], ["AN", 5, 1, 6], ["FU", 7, [0, 1, 2, 3]], ["SP", 7, 0, 8, [1], 1], ["AN", 7, 1, 2], ["FFSP", 7, 0, [14, 13, 12, 11], 1, 1], ["AN", 7, 1, 6], ["FU", 9, [0, 1, 2, 3]], ["AN", 9, 0, 5], ["FU", 9, [1, 2, 3, 4]], ["AN", 9, 1, 4], ["FU", 9, [2, 3, 4, 5]], ["AN", 9, 2, 6], ["FU", 11, [0, 1, 2, 3]], ["SP", 11, 0, 25088, [56], 1], ["AN", 11, 0, 5], ["AN", 11, 1, 6], ["FU", 15, [0, 1, 2, 3]], ["SP", 15, 0, 100352, [64], 1], ["AN", 15, 0, 5], ["AN", 15, 1, 6], ["PR", 8, 0, "auto_unroll_max_step$512"]]]], "r": [[2.58382e-05], 0, 2.28848, 1597631174], "v": "v0.2"}
{"i": [["[\"e7e49065818faaa0e0853fc150456923\"]", "cuda"], [[], [["CI", 5], ["SP", 3, 0, 1, [1, 1, 1, 1], 1], ["SP", 3, 5, 28, [2, 2, 1, 1], 1], ["SP", 3, 10, 28, [1, 4, 1, 1], 1], ["SP", 3, 15, 128, [1, 16, 1, 2], 1], ["SP", 3, 20, 1, [1, 1], 1], ["SP", 3, 23, 1, [1, 1], 1], ["SP", 3, 26, 512, [2, 64], 1], ["RE", 3, [0, 5, 10, 15, 1, 6, 11, 16, 2, 7, 12, 17, 20, 23, 26, 21, 24, 27, 3, 8, 13, 18, 22, 25, 28, 4, 9, 14, 19]], ["FSP", 6, 0, 1, 3], ["FSP", 6, 4, 2, 3], ["FSP", 6, 8, 3, 3], ["FSP", 6, 12, 4, 3], ["RE", 6, [0, 4, 8, 12, 1, 5, 9, 13, 2, 6, 10, 14, 3, 7, 11, 15]], ["CA", 3, 6, 11], ["CHR", 2, "shared", [3]], ["CA", 3, 4, 14], ["CHR", 1, "shared", [4]], ["CA", 2, 5, 14], ["CI", 1], ["FU", 2, [0, 1, 2, 3]], ["SP", 2, 0, 28, [1], 1], ["AN", 2, 1, 2], ["FFSP", 2, 0, [4, 3, 2, 1], 1, 1], ["AN", 2, 1, 6], ["FU", 4, [0, 1, 2, 3]], ["SP", 4, 0, 2, [2], 1], ["AN", 4, 1, 2], ["FFSP", 4, 0, [4, 3, 2, 1], 1, 1], ["AN", 4, 1, 6], ["FU", 8, [0, 1, 2, 3]], ["AN", 8, 0, 5], ["FU", 8, [1, 2, 3, 4]], ["AN", 8, 1, 4], ["FU", 8, [2, 3, 4, 5]], ["AN", 8, 2, 6], ["PR", 5, 0, "auto_unroll_max_step$1024"]]]], "r": [[1.93159e-05], 0, 1.66663, 1597640321], "v": "v0.2"}
{"i": [["[\"a8f0d599c2de3d7f63c1c967730fcb3a\"]", "cuda"], [[], [["SP", 3, 0, 1, [1, 1, 1, 1], 1], ["SP", 3, 5, 28, [1, 1, 1, 7], 1], ["SP", 3, 10, 28, [1, 4, 1, 1], 1], ["SP", 3, 15, 512, [2, 32, 1, 1], 1], ["SP", 3, 20, 1, [1, 1], 1], ["SP", 3, 23, 1, [1, 1], 1], ["SP", 3, 26, 128, [8, 4], 1], ["RE", 3, [0, 5, 10, 15, 1, 6, 11, 16, 2, 7, 12, 17, 20, 23, 26, 21, 24, 27, 3, 8, 13, 18, 22, 25, 28, 4, 9, 14, 19]], ["FSP", 5, 0, 0, 3], ["FSP", 5, 4, 1, 3], ["FSP", 5, 8, 2, 3], ["FSP", 5, 12, 3, 3], ["RE", 5, [0, 4, 8, 12, 1, 5, 9, 13, 2, 6, 10, 14, 3, 7, 11, 15]], ["CA", 3, 5, 11], ["CHR", 2, "shared", [3]], ["CA", 3, 4, 14], ["CHR", 1, "shared", [4]], ["CA", 2, 5, 14], ["CI", 1], ["FU", 2, [0, 1, 2, 3]], ["SP", 2, 0, 448, [1], 1], ["AN", 2, 1, 2], ["FFSP", 2, 0, [3, 2, 1, 0], 1, 1], ["AN", 2, 1, 6], ["FU", 4, [0, 1, 2, 3]], ["SP", 4, 0, 64, [1], 1], ["AN", 4, 1, 2], ["FFSP", 4, 0, [3, 2, 1, 0], 1, 1], ["AN", 4, 1, 6], ["FU", 7, [0, 1, 2, 3]], ["AN", 7, 0, 5], ["FU", 7, [1, 2, 3, 4]], ["AN", 7, 1, 4], ["FU", 7, [2, 3, 4, 5]], ["AN", 7, 2, 6], ["PR", 5, 0, "auto_unroll_max_step$64"]]]], "r": [[1.26841e-05], 0, 2.03441, 1597666035], "v": "v0.2"}
{"i": [["[\"cda401fbe25efb32032c5fd4a72c5bc5\"]", "cuda"], [[], [["CI", 5], ["SP", 3, 0, 1, [1, 1, 1, 1], 1], ["SP", 3, 5, 28, [1, 7, 1, 4], 1], ["SP", 3, 10, 28, [1, 1, 1, 1], 1], ["SP", 3, 15, 128, [2, 32, 1, 1], 1], ["SP", 3, 20, 1, [1, 1], 1], ["SP", 3, 23, 1, [1, 1], 1], ["SP", 3, 26, 256, [8, 4], 1], ["RE", 3, [0, 5, 10, 15, 1, 6, 11, 16, 2, 7, 12, 17, 20, 23, 26, 21, 24, 27, 3, 8, 13, 18, 22, 25, 28, 4, 9, 14, 19]], ["FSP", 6, 0, 1, 3], ["FSP", 6, 4, 2, 3], ["FSP", 6, 8, 3, 3], ["FSP", 6, 12, 4, 3], ["RE", 6, [0, 4, 8, 12, 1, 5, 9, 13, 2, 6, 10, 14, 3, 7, 11, 15]], ["CA", 3, 6, 11], ["CHR", 2, "shared", [3]], ["CA", 3, 4, 14], ["CHR", 1, "shared", [4]], ["CA", 2, 5, 14], ["CI", 1], ["FU", 2, [0, 1, 2, 3]], ["SP", 2, 0, 16, [2], 1], ["AN", 2, 1, 2], ["FFSP", 2, 0, [4, 3, 2, 1], 1, 1], ["AN", 2, 1, 6], ["FU", 4, [0, 1, 2, 3]], ["SP", 4, 0, 16, [1], 1], ["AN", 4, 1, 2], ["FFSP", 4, 0, [4, 3, 2, 1], 1, 1], ["AN", 4, 1, 6], ["FU", 8, [0, 1, 2, 3]], ["AN", 8, 0, 5], ["FU", 8, [1, 2, 3, 4]], ["AN", 8, 1, 4], ["FU", 8, [2, 3, 4, 5]], ["AN", 8, 2, 6], ["PR", 5, 0, "auto_unroll_max_step$1024"]]]], "r": [[1.32115e-05], 0, 2.77599, 1597641016], "v": "v0.2"}
{"i": [["[\"2161e556cbfbea15d8af41af25fa78ce\"]", "cuda"], [[], [["CI", 7], ["CI", 5], ["SP", 3, 0, 1, [1, 1, 1, 1], 1], ["SP", 3, 5, 56, [1, 1, 1, 1], 1], ["SP", 3, 10, 56, [2, 14, 2, 1], 1], ["SP", 3, 15, 256, [2, 32, 1, 1], 1], ["SP", 3, 20, 1, [1, 1], 1], ["SP", 3, 23, 1, [1, 1], 1], ["SP", 3, 26, 64, [8, 8], 1], ["RE", 3, [0, 5, 10, 15, 1, 6, 11, 16, 2, 7, 12, 17, 20, 23, 26, 21, 24, 27, 3, 8, 13, 18, 22, 25, 28, 4, 9, 14, 19]], ["FSP", 8, 0, 2, 3], ["FSP", 8, 4, 3, 3], ["FSP", 8, 8, 4, 3], ["FSP", 8, 12, 5, 3], ["RE", 8, [0, 4, 8, 12, 1, 5, 9, 13, 2, 6, 10, 14, 3, 7, 11, 15]], ["CA", 3, 8, 11], ["CHR", 2, "shared", [3]], ["CA", 3, 4, 14], ["CHR", 1, "shared", [4]], ["CA", 2, 5, 14], ["CI", 1], ["FU", 2, [0, 1, 2, 3]], ["SP", 2, 0, 128, [1], 1], ["AN", 2, 1, 2], ["FFSP", 2, 0, [5, 4, 3, 2], 1, 1], ["AN", 2, 1, 6], ["FU", 4, [0, 1, 2, 3]], ["SP", 4, 0, 128, [1], 1], ["AN", 4, 1, 2], ["FFSP", 4, 0, [5, 4, 3, 2], 1, 1], ["AN", 4, 1, 6], ["FU", 10, [0, 1, 2, 3]], ["AN", 10, 0, 5], ["FU", 10, [1, 2, 3, 4]], ["AN", 10, 1, 4], ["FU", 10, [2, 3, 4, 5]], ["AN", 10, 2, 6], ["PR", 5, 0, "auto_unroll_max_step$512"]]]], "r": [[1.44249e-05], 0, 3.38088, 1597633927], "v": "v0.2"}
{"i": [["[\"11f65dc3c8e55d82e254e6f144f29317\"]", "cuda"], [[], [["CI", 11], ["CI", 9], ["AN", 8, 0, 1], ["AN", 8, 1, 1], ["SP", 8, 2, 196, [1], 1], ["SP", 8, 4, 64, [32], 1], ["AN", 8, 6, 1], ["AN", 8, 7, 1], ["RE", 8, [2, 4, 3, 5, 0, 1, 6, 7]], ["CI", 7], ["CHW", 6, "local"], ["SP", 6, 0, 6, [1, 1, 1, 1], 1], ["SP", 6, 5, 6, [1, 1, 1, 1], 1], ["SP", 6, 10, 196, [7, 1, 4, 1], 1], ["SP", 6, 15, 64, [1, 64, 1, 1], 1], ["SP", 6, 20, 64, [4, 4], 1], ["RE", 6, [0, 5, 10, 15, 1, 6, 11, 16, 2, 7, 12, 17, 20, 21, 3, 8, 13, 18, 22, 4, 9, 14, 19]], ["FSP", 7, 0, 11, 3], ["FSP", 7, 4, 12, 3], ["FSP", 7, 8, 13, 3], ["FSP", 7, 12, 14, 3], ["RE", 7, [0, 4, 8, 12, 1, 5, 9, 13, 2, 6, 10, 14, 3, 7, 11, 15]], ["CA", 6, 7, 11], ["CHR", 5, "shared", [6]], ["CA", 6, 7, 12], ["CHR", 4, "shared", [7]], ["CA", 5, 8, 12], ["AN", 4, 0, 1], ["AN", 4, 1, 1], ["SP", 4, 2, 196, [14], 1], ["SP", 4, 4, 64, [32], 1], ["AN", 4, 6, 1], ["AN", 4, 7, 1], ["RE", 4, [2, 4, 3, 5, 0, 1, 6, 7]], ["CI", 3], ["CA", 2, 4, 3], ["CI", 1], ["FU", 4, [0, 1, 2, 3]], ["SP", 4, 0, 12544, [64], 1], ["AN", 4, 0, 5], ["AN", 4, 1, 6], ["FU", 5, [0, 1, 2, 3]], ["SP", 5, 0, 64, [2], 1], ["AN", 5, 1, 2], ["FFSP", 5, 0, [14, 13, 12, 11], 1, 1], ["AN", 5, 1, 6], ["FU", 7, [0, 1, 2, 3]], ["SP", 7, 0, 128, [4], 1], ["AN", 7, 1, 2], ["FFSP", 7, 0, [14, 13, 12, 11], 1, 1], ["AN", 7, 1, 6], ["FU", 9, [0, 1, 2, 3]], ["AN", 9, 0, 5], ["FU", 9, [1, 2, 3, 4]], ["AN", 9, 1, 4], ["FU", 9, [2, 3, 4, 5]], ["AN", 9, 2, 6], ["FU", 11, [0, 1, 2, 3]], ["SP", 11, 0, 12544, [32], 1], ["AN", 11, 0, 5], ["AN", 11, 1, 6], ["FU", 15, [0, 1, 2, 3]], ["SP", 15, 0, 200704, [64], 1], ["AN", 15, 0, 5], ["AN", 15, 1, 6], ["PR", 8, 0, "auto_unroll_max_step$1024"]]]], "r": [[2.48852e-05], 0, 5.69092, 1597610622], "v": "v0.2"}
{"i": [["[\"982921cff2ce662c10cc598b1bf2f86f\"]", "cuda"], [[], [["CI", 5], ["SP", 3, 0, 1, [1, 1, 1, 1], 1], ["SP", 3, 5, 56, [1, 1, 2, 2], 1], ["SP", 3, 10, 56, [1, 4, 1, 1], 1], ["SP", 3, 15, 64, [1, 16, 2, 1], 1], ["SP", 3, 20, 1, [1, 1], 1], ["SP", 3, 23, 1, [1, 1], 1], ["SP", 3, 26, 256, [64, 1], 1], ["RE", 3, [0, 5, 10, 15, 1, 6, 11, 16, 2, 7, 12, 17, 20, 23, 26, 21, 24, 27, 3, 8, 13, 18, 22, 25, 28, 4, 9, 14, 19]], ["FSP", 6, 0, 1, 3], ["FSP", 6, 4, 2, 3], ["FSP", 6, 8, 3, 3], ["FSP", 6, 12, 4, 3], ["RE", 6, [0, 4, 8, 12, 1, 5, 9, 13, 2, 6, 10, 14, 3, 7, 11, 15]], ["CA", 3, 6, 11], ["CHR", 2, "shared", [3]], ["CA", 3, 4, 14], ["CHR", 1, "shared", [4]], ["CA", 2, 5, 14], ["CI", 1], ["FU", 2, [0, 1, 2, 3]], ["SP", 2, 0, 4, [1], 1], ["AN", 2, 1, 2], ["FFSP", 2, 0, [4, 3, 2, 1], 1, 1], ["AN", 2, 1, 6], ["FU", 4, [0, 1, 2, 3]], ["SP", 4, 0, 2, [1], 1], ["AN", 4, 1, 2], ["FFSP", 4, 0, [4, 3, 2, 1], 1, 1], ["AN", 4, 1, 6], ["FU", 8, [0, 1, 2, 3]], ["AN", 8, 0, 5], ["FU", 8, [1, 2, 3, 4]], ["AN", 8, 1, 4], ["FU", 8, [2, 3, 4, 5]], ["AN", 8, 2, 6], ["PR", 5, 0, "auto_unroll_max_step$512"]]]], "r": [[1.52074e-05], 0, 2.02799, 1597651566], "v": "v0.2"}
{"i": [["[\"b25c1066e1faf4ad23080dab0639c68b\"]", "cuda"], [[], [["SP", 3, 0, 1, [1, 1, 1, 1], 1], ["SP", 3, 5, 56, [1, 8, 1, 1], 1], ["SP", 3, 10, 56, [2, 1, 2, 1], 1], ["SP", 3, 15, 256, [2, 32, 1, 1], 1], ["SP", 3, 20, 1, [1, 1], 1], ["SP", 3, 23, 1, [1, 1], 1], ["SP", 3, 26, 64, [16, 2], 1], ["RE", 3, [0, 5, 10, 15, 1, 6, 11, 16, 2, 7, 12, 17, 20, 23, 26, 21, 24, 27, 3, 8, 13, 18, 22, 25, 28, 4, 9, 14, 19]], ["FSP", 5, 0, 0, 3], ["FSP", 5, 4, 1, 3], ["FSP", 5, 8, 2, 3], ["FSP", 5, 12, 3, 3], ["RE", 5, [0, 4, 8, 12, 1, 5, 9, 13, 2, 6, 10, 14, 3, 7, 11, 15]], ["CA", 3, 5, 11], ["CHR", 2, "shared", [3]], ["CA", 3, 4, 14], ["CHR", 1, "shared", [4]], ["CA", 2, 5, 14], ["CI", 1], ["FU", 2, [0, 1, 2, 3]], ["SP", 2, 0, 224, [2], 1], ["AN", 2, 1, 2], ["FFSP", 2, 0, [3, 2, 1, 0], 1, 1], ["AN", 2, 1, 6], ["FU", 4, [0, 1, 2, 3]], ["SP", 4, 0, 32, [1], 1], ["AN", 4, 1, 2], ["FFSP", 4, 0, [3, 2, 1, 0], 1, 1], ["AN", 4, 1, 6], ["FU", 7, [0, 1, 2, 3]], ["AN", 7, 0, 5], ["FU", 7, [1, 2, 3, 4]], ["AN", 7, 1, 4], ["FU", 7, [2, 3, 4, 5]], ["AN", 7, 2, 6], ["PR", 5, 0, "auto_unroll_max_step$1024"]]]], "r": [[1.39849e-05], 0, 2.68353, 1597660443], "v": "v0.2"}
{"i": [["[\"2ec4f2a50f0817d0eab6e1ee21326df1\"]", "cuda"], [[], [["CI", 5], ["SP", 3, 0, 1, [1, 1, 1, 1], 1], ["SP", 3, 5, 56, [1, 1, 1, 1], 1], ["SP", 3, 10, 56, [8, 1, 1, 1], 1], ["SP", 3, 15, 64, [1, 64, 1, 1], 1], ["SP", 3, 20, 1, [1, 1], 1], ["SP", 3, 23, 1, [1, 1], 1], ["SP", 3, 26, 64, [16, 2], 1], ["RE", 3, [0, 5, 10, 15, 1, 6, 11, 16, 2, 7, 12, 17, 20, 23, 26, 21, 24, 27, 3, 8, 13, 18, 22, 25, 28, 4, 9, 14, 19]], ["FSP", 6, 0, 1, 3], ["FSP", 6, 4, 2, 3], ["FSP", 6, 8, 3, 3], ["FSP", 6, 12, 4, 3], ["RE", 6, [0, 4, 8, 12, 1, 5, 9, 13, 2, 6, 10, 14, 3, 7, 11, 15]], ["CA", 3, 6, 11], ["CHR", 2, "shared", [3]], ["CA", 3, 4, 14], ["CHR", 1, "shared", [4]], ["CA", 2, 5, 14], ["CI", 1], ["FU", 2, [0, 1, 2, 3]], ["SP", 2, 0, 32, [2], 1], ["AN", 2, 1, 2], ["FFSP", 2, 0, [4, 3, 2, 1], 1, 1], ["AN", 2, 1, 6], ["FU", 4, [0, 1, 2, 3]], ["SP", 4, 0, 32, [2], 1], ["AN", 4, 1, 2], ["FFSP", 4, 0, [4, 3, 2, 1], 1, 1], ["AN", 4, 1, 6], ["FU", 8, [0, 1, 2, 3]], ["AN", 8, 0, 5], ["FU", 8, [1, 2, 3, 4]], ["AN", 8, 1, 4], ["FU", 8, [2, 3, 4, 5]], ["AN", 8, 2, 6], ["PR", 5, 0, "auto_unroll_max_step$1024"]]]], "r": [[6.75552e-06], 0, 2.28729, 1597599093], "v": "v0.2"}
{"i": [["[\"5324a9485fb0ee400de6218639542538\"]", "cuda"], [[], [["CI", 4], ["CI", 1], ["FU", 2, [0, 1, 2, 3]], ["SP", 2, 0, 200704, [64], 1], ["AN", 2, 0, 5], ["AN", 2, 1, 6], ["FU", 5, [0, 1, 2, 3]], ["SP", 5, 0, 200704, [64], 1], ["AN", 5, 0, 5], ["AN", 5, 1, 6]]]], "r": [[1.28051e-05], 0, 1.77979, 1597584567], "v": "v0.2"}
{"i": [["[\"00c1fe573ead0c4b81459fe3dcd21e76\"]", "cuda"], [[], [["CI", 5], ["SP", 3, 0, 1, [1, 1, 1, 1], 1], ["SP", 3, 5, 112, [1, 14, 1, 1], 1], ["SP", 3, 10, 112, [4, 1, 1, 2], 1], ["SP", 3, 15, 64, [1, 32, 1, 1], 1], ["SP", 3, 20, 7, [1, 7], 1], ["SP", 3, 23, 7, [1, 7], 1], ["SP", 3, 26, 3, [3, 1], 1], ["RE", 3, [0, 5, 10, 15, 1, 6, 11, 16, 2, 7, 12, 17, 20, 23, 26, 21, 24, 27, 3, 8, 13, 18, 22, 25, 28, 4, 9, 14, 19]], ["FSP", 6, 0, 1, 3], ["FSP", 6, 4, 2, 3], ["FSP", 6, 8, 3, 3], ["FSP", 6, 12, 4, 3], ["RE", 6, [0, 4, 8, 12, 1, 5, 9, 13, 2, 6, 10, 14, 3, 7, 11, 15]], ["CA", 3, 6, 11], ["CHR", 2, "shared", [3]], ["CA", 3, 4, 14], ["CHR", 1, "shared", [4]], ["CA", 2, 5, 14], ["CI", 1], ["FU", 2, [0, 1, 2, 3]], ["SP", 2, 0, 273, [1], 1], ["AN", 2, 1, 2], ["FFSP", 2, 0, [4, 3, 2, 1], 1, 1], ["AN", 2, 1, 6], ["FU", 4, [0, 1, 2, 3]], ["SP", 4, 0, 147, [1], 1], ["AN", 4, 1, 2], ["FFSP", 4, 0, [4, 3, 2, 1], 1, 1], ["AN", 4, 1, 6], ["FU", 8, [0, 1, 2, 3]], ["AN", 8, 0, 5], ["FU", 8, [1, 2, 3, 4]], ["AN", 8, 1, 4], ["FU", 8, [2, 3, 4, 5]], ["AN", 8, 2, 6], ["PR", 5, 0, "auto_unroll_max_step$512"]]]], "r": [[2.33703e-05], 0, 2.28001, 1597588479], "v": "v0.2"}
{"i": [["[\"8041a51921ad345e8ce5bc13ce8d56b8\"]", "cuda"], [[], [["CHW", 3, "local"], ["SP", 3, 0, 1, [1, 1, 1, 1], 1], ["SP", 3, 5, 56, [1, 4, 2, 1], 1], ["SP", 3, 10, 56, [2, 1, 2, 1], 1], ["SP", 3, 15, 256, [2, 32, 1, 1], 1], ["SP", 3, 20, 1, [1, 1], 1], ["SP", 3, 23, 1, [1, 1], 1], ["SP", 3, 26, 64, [16, 2], 1], ["RE", 3, [0, 5, 10, 15, 1, 6, 11, 16, 2, 7, 12, 17, 20, 23, 26, 21, 24, 27, 3, 8, 13, 18, 22, 25, 28, 4, 9, 14, 19]], ["FSP", 4, 0, 1, 3], ["FSP", 4, 4, 2, 3], ["FSP", 4, 8, 3, 3], ["FSP", 4, 12, 4, 3], ["RE", 4, [0, 4, 8, 12, 1, 5, 9, 13, 2, 6, 10, 14, 3, 7, 11, 15]], ["CA", 3, 4, 11], ["CHR", 2, "shared", [3]], ["CA", 3, 4, 14], ["CHR", 1, "shared", [4]], ["CA", 2, 5, 14], ["CI", 1], ["FU", 2, [0, 1, 2, 3]], ["SP", 2, 0, 64, [1], 1], ["AN", 2, 1, 2], ["FFSP", 2, 0, [4, 3, 2, 1], 1, 1], ["AN", 2, 1, 6], ["FU", 4, [0, 1, 2, 3]], ["SP", 4, 0, 32, [1], 1], ["AN", 4, 1, 2], ["FFSP", 4, 0, [4, 3, 2, 1], 1, 1], ["AN", 4, 1, 6], ["FU", 6, [0, 1, 2, 3]], ["AN", 6, 0, 5], ["FU", 6, [1, 2, 3, 4]], ["AN", 6, 1, 4], ["FU", 6, [2, 3, 4, 5]], ["AN", 6, 2, 6], ["PR", 5, 0, "auto_unroll_max_step$0"]]]], "r": [[1.14488e-05], 0, 2.41394, 1597616013], "v": "v0.2"}
{"i": [["[\"b1ce722fb912bb6d196a6f336dcfcdc7\"]", "cuda"], [[], [["CHW", 3, "local"], ["SP", 3, 0, 1, [1, 1, 1, 1], 1], ["SP", 3, 5, 28, [1, 1, 14, 1], 1], ["SP", 3, 10, 28, [1, 1, 1, 1], 1], ["SP", 3, 15, 512, [1, 128, 1, 1], 1], ["SP", 3, 20, 1, [1, 1], 1], ["SP", 3, 23, 1, [1, 1], 1], ["SP", 3, 26, 256, [1, 32], 1], ["RE", 3, [0, 5, 10, 15, 1, 6, 11, 16, 2, 7, 12, 17, 20, 23, 26, 21, 24, 27, 3, 8, 13, 18, 22, 25, 28, 4, 9, 14, 19]], ["FSP", 4, 0, 1, 3], ["FSP", 4, 4, 2, 3], ["FSP", 4, 8, 3, 3], ["FSP", 4, 12, 4, 3], ["RE", 4, [0, 4, 8, 12, 1, 5, 9, 13, 2, 6, 10, 14, 3, 7, 11, 15]], ["CA", 3, 4, 11], ["CHR", 2, "shared", [3]], ["CA", 3, 4, 14], ["CHR", 1, "shared", [4]], ["CA", 2, 5, 14], ["CI", 1], ["FU", 2, [0, 1, 2, 3]], ["SP", 2, 0, 208, [1], 1], ["AN", 2, 1, 2], ["FFSP", 2, 0, [4, 3, 2, 1], 1, 1], ["AN", 2, 1, 6], ["FU", 4, [0, 1, 2, 3]], ["SP", 4, 0, 32, [2], 1], ["AN", 4, 1, 2], ["FFSP", 4, 0, [4, 3, 2, 1], 1, 1], ["AN", 4, 1, 6], ["FU", 6, [0, 1, 2, 3]], ["AN", 6, 0, 5], ["FU", 6, [1, 2, 3, 4]], ["AN", 6, 1, 4], ["FU", 6, [2, 3, 4, 5]], ["AN", 6, 2, 6], ["PR", 5, 0, "auto_unroll_max_step$1024"]]]], "r": [[2.72705e-05], 0, 2.69733, 1597595695], "v": "v0.2"}
{"i": [["[\"219540b70f8da4faef267a25f45c21db\"]", "cuda"], [[], [["CHW", 3, "local"], ["SP", 3, 0, 1, [1, 1, 1, 1], 1], ["SP", 3, 5, 14, [1, 1, 1, 1], 1], ["SP", 3, 10, 14, [1, 2, 7, 1], 1], ["SP", 3, 15, 1024, [1, 64, 1, 1], 1], ["SP", 3, 20, 1, [1, 1], 1], ["SP", 3, 23, 1, [1, 1], 1], ["SP", 3, 26, 512, [16, 1], 1], ["RE", 3, [0, 5, 10, 15, 1, 6, 11, 16, 2, 7, 12, 17, 20, 23, 26, 21, 24, 27, 3, 8, 13, 18, 22, 25, 28, 4, 9, 14, 19]], ["FSP", 4, 0, 1, 3], ["FSP", 4, 4, 2, 3], ["FSP", 4, 8, 3, 3], ["FSP", 4, 12, 4, 3], ["RE", 4, [0, 4, 8, 12, 1, 5, 9, 13, 2, 6, 10, 14, 3, 7, 11, 15]], ["CA", 3, 4, 11], ["CHR", 2, "shared", [3]], ["CA", 3, 4, 14], ["CHR", 1, "shared", [4]], ["CA", 2, 5, 14], ["CI", 1], ["FU", 2, [0, 1, 2, 3]], ["SP", 2, 0, 416, [1], 1], ["AN", 2, 1, 2], ["FFSP", 2, 0, [4, 3, 2, 1], 1, 1], ["AN", 2, 1, 6], ["FU", 4, [0, 1, 2, 3]], ["SP", 4, 0, 32, [2], 1], ["AN", 4, 1, 2], ["FFSP", 4, 0, [4, 3, 2, 1], 1, 1], ["AN", 4, 1, 6], ["FU", 6, [0, 1, 2, 3]], ["AN", 6, 0, 5], ["FU", 6, [1, 2, 3, 4]], ["AN", 6, 1, 4], ["FU", 6, [2, 3, 4, 5]], ["AN", 6, 2, 6], ["PR", 5, 0, "auto_unroll_max_step$64"]]]], "r": [[3.44339e-05], 0, 1.98279, 1597635035], "v": "v0.2"}
{"i": [["[\"3d760525ca6558b8c264cb30449731d3\"]", "cuda"], [[], [["CHW", 3, "local"], ["SP", 3, 0, 1, [1, 1, 1, 1], 1], ["SP", 3, 5, 7, [1, 1, 1, 7], 1], ["SP", 3, 10, 7, [1, 1, 1, 1], 1], ["SP", 3, 15, 2048, [1, 64, 1, 1], 1], ["SP", 3, 20, 1, [1, 1], 1], ["SP", 3, 23, 1, [1, 1], 1], ["SP", 3, 26, 1024, [4, 16], 1], ["RE", 3, [0, 5, 10, 15, 1, 6, 11, 16, 2, 7, 12, 17, 20, 23, 26, 21, 24, 27, 3, 8, 13, 18, 22, 25, 28, 4, 9, 14, 19]], ["FSP", 4, 0, 1, 3], ["FSP", 4, 4, 2, 3], ["FSP", 4, 8, 3, 3], ["FSP", 4, 12, 4, 3], ["RE", 4, [0, 4, 8, 12, 1, 5, 9, 13, 2, 6, 10, 14, 3, 7, 11, 15]], ["CA", 3, 4, 11], ["CHR", 2, "shared", [3]], ["CA", 3, 4, 14], ["CHR", 1, "shared", [4]], ["CA", 2, 5, 14], ["CI", 1], ["FU", 2, [0, 1, 2, 3]], ["SP", 2, 0, 8, [1], 1], ["AN", 2, 1, 2], ["FFSP", 2, 0, [4, 3, 2, 1], 1, 1], ["AN", 2, 1, 6], ["FU", 4, [0, 1, 2, 3]], ["SP", 4, 0, 16, [4], 1], ["AN", 4, 1, 2], ["FFSP", 4, 0, [4, 3, 2, 1], 1, 1], ["AN", 4, 1, 6], ["FU", 6, [0, 1, 2, 3]], ["AN", 6, 0, 5], ["FU", 6, [1, 2, 3, 4]], ["AN", 6, 1, 4], ["FU", 6, [2, 3, 4, 5]], ["AN", 6, 2, 6], ["PR", 5, 0, "auto_unroll_max_step$512"]]]], "r": [[5.2055e-05], 0, 2.96974, 1597643669], "v": "v0.2"}
{"i": [["[\"cb6435dcf5b5500a6bb3bd826edb87c9\"]", "cuda"], [[], [["CI", 2], ["SP", 1, 1, 1000, [50], 1], ["AN", 1, 2, 6], ["AN", 1, 0, 5], ["AN", 3, 0, 6], ["FU", 4, [0, 1]], ["SP", 4, 0, 16000, [64], 1], ["AN", 4, 0, 5], ["AN", 4, 1, 6]]]], "r": [[3.63291e-05], 0, 1.81518, 1597786967], "v": "v0.2"}
{"i": [["[\"a1c435cc5cbfd31bc2c91d3e42ffc0b6\"]", "cuda"], [[], [["SP", 2, 0, 16, [4, 4, 1, 1], 1], ["SP", 2, 5, 1000, [1, 20, 1, 1], 1], ["SP", 2, 10, 2048, [8, 32], 1], ["RE", 2, [0, 5, 1, 6, 2, 7, 10, 11, 3, 8, 12, 4, 9]], ["FSP", 4, 0, 0, 3], ["FSP", 4, 4, 1, 3], ["RE", 4, [0, 4, 1, 5, 2, 6, 3, 7]], ["CA", 2, 4, 5], ["CHR", 1, "shared", [2]], ["CA", 2, 3, 6], ["CHR", 0, "shared", [3]], ["CA", 1, 4, 6], ["FU", 1, [0, 1]], ["SP", 1, 0, 128, [2], 1], ["AN", 1, 1, 2], ["FFSP", 1, 0, [1, 0], 1, 1], ["AN", 1, 1, 6], ["FU", 3, [0, 1]], ["SP", 3, 0, 128, [4], 1], ["AN", 3, 1, 2], ["FFSP", 3, 0, [1, 0], 1, 1], ["AN", 3, 1, 6], ["FU", 6, [0, 1]], ["AN", 6, 0, 5], ["FU", 6, [1, 2]], ["AN", 6, 1, 4], ["FU", 6, [2, 3]], ["AN", 6, 2, 6], ["PR", 4, 0, "auto_unroll_max_step$64"]]]], "r": [[6.59741e-05], 0, 2.48268, 1597791628], "v": "v0.2"}
{"i": [["[\"2b4fc799c8ad20cc4710ccdba716fbd2\"]", "cuda"], [[], [["FU", 1, [0, 1, 2, 3]], ["SP", 1, 0, 32768, [64], 1], ["AN", 1, 0, 5], ["AN", 1, 1, 6], ["FU", 2, [0, 1, 2, 3]], ["SP", 2, 0, 32768, [64], 1], ["AN", 2, 0, 5], ["AN", 2, 1, 6]]]], "r": [[1.00251e-05], 0, 2.42546, 1597666539], "v": "v0.2"}
{"i": [["[\"cf1cb0f0971a0ef1902ffec9cc073244\"]", "cuda"], [[], [["CI", 9], ["CI", 7], ["CI", 5], ["SP", 3, 0, 16, [2, 8, 1, 1], 1], ["SP", 3, 5, 7, [1, 1, 1, 7], 1], ["SP", 3, 10, 7, [1, 1, 1, 1], 1], ["SP", 3, 15, 2048, [2, 16, 2, 1], 1], ["SP", 3, 20, 1, [1, 1], 1], ["SP", 3, 23, 1, [1, 1], 1], ["SP", 3, 26, 512, [4, 4], 1], ["RE", 3, [0, 5, 10, 15, 1, 6, 11, 16, 2, 7, 12, 17, 20, 23, 26, 21, 24, 27, 3, 8, 13, 18, 22, 25, 28, 4, 9, 14, 19]], ["FSP", 10, 0, 3, 3], ["FSP", 10, 4, 4, 3], ["FSP", 10, 8, 5, 3], ["FSP", 10, 12, 6, 3], ["RE", 10, [0, 4, 8, 12, 1, 5, 9, 13, 2, 6, 10, 14, 3, 7, 11, 15]], ["CA", 3, 10, 11], ["CHR", 2, "shared", [3]], ["CA", 3, 4, 14], ["CHR", 1, "shared", [4]], ["CA", 2, 5, 14], ["CI", 1], ["FU", 2, [0, 1, 2, 3]], ["SP", 2, 0, 16, [1], 1], ["AN", 2, 1, 2], ["FFSP", 2, 0, [6, 5, 4, 3], 1, 1], ["AN", 2, 1, 6], ["FU", 4, [0, 1, 2, 3]], ["SP", 4, 0, 64, [4], 1], ["AN", 4, 1, 2], ["FFSP", 4, 0, [6, 5, 4, 3], 1, 1], ["AN", 4, 1, 6], ["FU", 12, [0, 1, 2, 3]], ["AN", 12, 0, 5], ["FU", 12, [1, 2, 3, 4]], ["AN", 12, 1, 4], ["FU", 12, [2, 3, 4, 5]], ["AN", 12, 2, 6], ["PR", 5, 0, "auto_unroll_max_step$1024"]]]], "r": [[0.000139459], 0, 4.584, 1597814358], "v": "v0.2"}
