scripts/op-subgraph-gpu-ansor-logs.json
{"i": [["[\"conv2d_nhwc_bn_relu\", 1, 224, 224, 3, 64, 7, 2, 3]", "cuda"], [[], [["CI", 9], ["CI", 7], ["CI", 5], ["SP", 3, 0, 1, [1, 1, 1, 1], 1], ["SP", 3, 5, 112, [1, 8, 1, 1], 1], ["SP", 3, 10, 112, [1, 1, 2, 4], 1], ["SP", 3, 15, 64, [2, 16, 1, 1], 1], ["SP", 3, 20, 7, [1, 1], 1], ["SP", 3, 23, 7, [7, 1], 1], ["SP", 3, 26, 3, [3, 1], 1], ["RE", 3, [0, 5, 10, 15, 1, 6, 11, 16, 2, 7, 12, 17, 20, 23, 26, 21, 24, 27, 3, 8, 13, 18, 22, 25, 28, 4, 9, 14, 19]], ["FSP", 10, 0, 3, 3], ["FSP", 10, 4, 4, 3], ["FSP", 10, 8, 5, 3], ["FSP", 10, 12, 6, 3], ["RE", 10, [0, 4, 8, 12, 1, 5, 9, 13, 2, 6, 10, 14, 3, 7, 11, 15]], ["CA", 3, 10, 11], ["CHR", 2, "shared", [3]], ["CA", 3, 4, 14], ["CHR", 1, "shared", [4]], ["CA", 2, 5, 14], ["CI", 1], ["FU", 12, [0, 1, 2, 3]], ["AN", 12, 0, 5], ["FU", 12, [1, 2, 3, 4]], ["AN", 12, 1, 4], ["FU", 12, [2, 3, 4, 5]], ["AN", 12, 2, 6], ["FU", 2, [0, 1, 2, 3]], ["SP", 2, 0, 39, [3], 1], ["AN", 2, 1, 2], ["FFSP", 2, 0, [6, 5, 4, 3], 1, 1], ["AN", 2, 1, 6], ["FU", 4, [0, 1, 2, 3]], ["SP", 4, 0, 4, [1], 1], ["AN", 4, 1, 2], ["FFSP", 4, 0, [6, 5, 4, 3], 1, 1], ["AN", 4, 1, 6], ["PR", 5, 0, "auto_unroll_max_step$512"]]]], "r": [[2.32929e-05], 0, 2.46924, 1593692135], "v": "v0.2"}
{"i": [["[\"conv2d_nhwc_bn_relu\", 16, 224, 224, 3, 64, 7, 2, 3]", "cuda"], [[], [["CI", 9], ["CI", 7], ["CI", 5], ["SP", 3, 0, 16, [1, 1, 1, 1], 1], ["SP", 3, 5, 112, [1, 8, 1, 1], 1], ["SP", 3, 10, 112, [1, 1, 1, 14], 1], ["SP", 3, 15, 64, [1, 16, 1, 2], 1], ["SP", 3, 20, 7, [7, 1], 1], ["SP", 3, 23, 7, [7, 1], 1], ["SP", 3, 26, 3, [1, 1], 1], ["RE", 3, [0, 5, 10, 15, 1, 6, 11, 16, 2, 7, 12, 17, 20, 23, 26, 21, 24, 27, 3, 8, 13, 18, 22, 25, 28, 4, 9, 14, 19]], ["FSP", 10, 0, 3, 3], ["FSP", 10, 4, 4, 3], ["FSP", 10, 8, 5, 3], ["FSP", 10, 12, 6, 3], ["RE", 10, [0, 4, 8, 12, 1, 5, 9, 13, 2, 6, 10, 14, 3, 7, 11, 15]], ["CA", 3, 10, 11], ["CHR", 2, "shared", [3]], ["CA", 3, 4, 14], ["CHR", 1, "shared", [4]], ["CA", 2, 5, 14], ["CI", 1], ["FU", 12, [0, 1, 2, 3]], ["AN", 12, 0, 5], ["FU", 12, [1, 2, 3, 4]], ["AN", 12, 1, 4], ["FU", 12, [2, 3, 4, 5]], ["AN", 12, 2, 6], ["FU", 2, [0, 1, 2, 3]], ["SP", 2, 0, 273, [1], 1], ["AN", 2, 1, 2], ["FFSP", 2, 0, [6, 5, 4, 3], 1, 1], ["AN", 2, 1, 6], ["FU", 4, [0, 1, 2, 3]], ["SP", 4, 0, 98, [1], 1], ["AN", 4, 1, 2], ["FFSP", 4, 0, [6, 5, 4, 3], 1, 1], ["AN", 4, 1, 6], ["PR", 5, 0, "auto_unroll_max_step$1024"]]]], "r": [[0.000310399], 0, 4.41711, 1593690501], "v": "v0.2"}
{"i": [["[\"conv2d_nhwc_bn_relu\", 1, 56, 56, 64, 128, 3, 2, 1]", "cuda"], [[], [["CI", 9], ["CI", 7], ["CI", 5], ["SP", 3, 0, 1, [1, 1, 1, 1], 1], ["SP", 3, 5, 28, [1, 2, 1, 2], 1], ["SP", 3, 10, 28, [1, 2, 2, 1], 1], ["SP", 3, 15, 128, [1, 32, 1, 1], 1], ["SP", 3, 20, 3, [1, 3], 1], ["SP", 3, 23, 3, [1, 3], 1], ["SP", 3, 26, 64, [2, 4], 1], ["RE", 3, [0, 5, 10, 15, 1, 6, 11, 16, 2, 7, 12, 17, 20, 23, 26, 21, 24, 27, 3, 8, 13, 18, 22, 25, 28, 4, 9, 14, 19]], ["FSP", 10, 0, 3, 3], ["FSP", 10, 4, 4, 3], ["FSP", 10, 8, 5, 3], ["FSP", 10, 12, 6, 3], ["RE", 10, [0, 4, 8, 12, 1, 5, 9, 13, 2, 6, 10, 14, 3, 7, 11, 15]], ["CA", 3, 10, 11], ["CHR", 2, "shared", [3]], ["CA", 3, 4, 14], ["CHR", 1, "shared", [4]], ["CA", 2, 5, 14], ["CI", 1], ["FU", 12, [0, 1, 2, 3]], ["AN", 12, 0, 5], ["FU", 12, [1, 2, 3, 4]], ["AN", 12, 1, 4], ["FU", 12, [2, 3, 4, 5]], ["AN", 12, 2, 6], ["FU", 2, [0, 1, 2, 3]], ["SP", 2, 0, 1392, [1], 1], ["AN", 2, 1, 2], ["FFSP", 2, 0, [6, 5, 4, 3], 1, 1], ["AN", 2, 1, 6], ["FU", 4, [0, 1, 2, 3]], ["SP", 4, 0, 48, [2], 1], ["AN", 4, 1, 2], ["FFSP", 4, 0, [6, 5, 4, 3], 1, 1], ["AN", 4, 1, 6], ["PR", 5, 0, "auto_unroll_max_step$512"]]]], "r": [[2.04284e-05], 0, 2.46441, 1593669222], "v": "v0.2"}
{"i": [["[\"conv2d_nhwc_bn_relu\", 16, 56, 56, 64, 128, 3, 2, 1]", "cuda"], [[], [["CI", 9], ["CI", 7], ["CI", 5], ["SP", 3, 0, 16, [1, 2, 1, 1], 1], ["SP", 3, 5, 28, [1, 1, 1, 14], 1], ["SP", 3, 10, 28, [1, 1, 1, 1], 1], ["SP", 3, 15, 128, [2, 64, 1, 1], 1], ["SP", 3, 20, 3, [3, 1], 1], ["SP", 3, 23, 3, [1, 1], 1], ["SP", 3, 26, 64, [4, 2], 1], ["RE", 3, [0, 5, 10, 15, 1, 6, 11, 16, 2, 7, 12, 17, 20, 23, 26, 21, 24, 27, 3, 8, 13, 18, 22, 25, 28, 4, 9, 14, 19]], ["FSP", 10, 0, 3, 3], ["FSP", 10, 4, 4, 3], ["FSP", 10, 8, 5, 3], ["FSP", 10, 12, 6, 3], ["RE", 10, [0, 4, 8, 12, 1, 5, 9, 13, 2, 6, 10, 14, 3, 7, 11, 15]], ["CA", 3, 10, 11], ["CHR", 2, "shared", [3]], ["CA", 3, 4, 14], ["CHR", 1, "shared", [4]], ["CA", 2, 5, 14], ["CI", 1], ["FU", 12, [0, 1, 2, 3]], ["AN", 12, 0, 5], ["FU", 12, [1, 2, 3, 4]], ["AN", 12, 1, 4], ["FU", 12, [2, 3, 4, 5]], ["AN", 12, 2, 6], ["FU", 2, [0, 1, 2, 3]], ["SP", 2, 0, 480, [1], 1], ["AN", 2, 1, 2], ["FFSP", 2, 0, [6, 5, 4, 3], 1, 1], ["AN", 2, 1, 6], ["FU", 4, [0, 1, 2, 3]], ["SP", 4, 0, 48, [4], 1], ["AN", 4, 1, 2], ["FFSP", 4, 0, [6, 5, 4, 3], 1, 1], ["AN", 4, 1, 6], ["PR", 5, 0, "auto_unroll_max_step$64"]]]], "r": [[0.000172404], 0, 2.32539, 1593685002], "v": "v0.2"}
{"i": [["[\"conv2d_nhwc_bn_relu\", 1, 28, 28, 128, 256, 1, 2, 0]", "cuda"], [[], [["CI", 9], ["CI", 7], ["CI", 5], ["SP", 3, 0, 1, [1, 1, 1, 1], 1], ["SP", 3, 5, 14, [2, 7, 1, 1], 1], ["SP", 3, 10, 14, [1, 2, 1, 1], 1], ["SP", 3, 15, 256, [1, 32, 1, 1], 1], ["SP", 3, 20, 1, [1, 1], 1], ["SP", 3, 23, 1, [1, 1], 1], ["SP", 3, 26, 128, [128, 1], 1], ["RE", 3, [0, 5, 10, 15, 1, 6, 11, 16, 2, 7, 12, 17, 20, 23, 26, 21, 24, 27, 3, 8, 13, 18, 22, 25, 28, 4, 9, 14, 19]], ["CHR", 2, "shared", [3]], ["CA", 3, 4, 14], ["CI", 1], ["FU", 4, [0, 1, 2, 3]], ["AN", 4, 0, 5], ["FU", 4, [1, 2, 3, 4]], ["AN", 4, 1, 4], ["FU", 4, [2, 3, 4, 5]], ["AN", 4, 2, 6], ["FU", 11, [0, 1, 2, 3]], ["SP", 11, 0, 50176, [2, 64], 1], ["AN", 11, 0, 5], ["AN", 11, 1, 4], ["AN", 11, 2, 6], ["FU", 3, [0, 1, 2, 3]], ["SP", 3, 0, 16, [1], 1], ["AN", 3, 1, 2], ["FFSP", 3, 0, [6, 5, 4, 3], 1, 1], ["AN", 3, 1, 6], ["PR", 4, 0, "auto_unroll_max_step$1024"]]]], "r": [[9.56989e-06], 0, 1.93537, 1593679273], "v": "v0.2"}
{"i": [["[\"conv2d_nhwc_bn_relu\", 16, 28, 28, 128, 256, 1, 2, 0]", "cuda"], [[], [["CI", 9], ["CI", 7], ["CI", 5], ["SP", 3, 0, 16, [2, 1, 1, 2], 1], ["SP", 3, 5, 14, [1, 2, 1, 1], 1], ["SP", 3, 10, 14, [1, 7, 1, 1], 1], ["SP", 3, 15, 256, [2, 32, 1, 1], 1], ["SP", 3, 20, 1, [1, 1], 1], ["SP", 3, 23, 1, [1, 1], 1], ["SP", 3, 26, 128, [128, 1], 1], ["RE", 3, [0, 5, 10, 15, 1, 6, 11, 16, 2, 7, 12, 17, 20, 23, 26, 21, 24, 27, 3, 8, 13, 18, 22, 25, 28, 4, 9, 14, 19]], ["FSP", 10, 0, 3, 3], ["FSP", 10, 4, 4, 3], ["FSP", 10, 8, 5, 3], ["FSP", 10, 12, 6, 3], ["RE", 10, [0, 4, 8, 12, 1, 5, 9, 13, 2, 6, 10, 14, 3, 7, 11, 15]], ["CA", 3, 10, 11], ["CHR", 2, "shared", [3]], ["CA", 3, 4, 14], ["CI", 1], ["FU", 11, [0, 1, 2, 3]], ["AN", 11, 0, 5], ["FU", 11, [1, 2, 3, 4]], ["AN", 11, 1, 4], ["FU", 11, [2, 3, 4, 5]], ["AN", 11, 2, 6], ["FU", 3, [0, 1, 2, 3]], ["SP", 3, 0, 32, [1], 1], ["AN", 3, 1, 2], ["FFSP", 3, 0, [6, 5, 4, 3], 1, 1], ["AN", 3, 1, 6], ["PR", 4, 0, "auto_unroll_max_step$0"]]]], "r": [[3.02211e-05], 0, 2.39973, 1593681426], "v": "v0.2"}
{"i": [["[\"conv2d_nhwc_bn_relu\", 1, 7, 7, 512, 512, 3, 1, 1]", "cuda"], [[], [["CI", 9], ["CI", 7], ["CI", 5], ["SP", 3, 0, 1, [1, 1, 1, 1], 1], ["SP", 3, 5, 7, [1, 7, 1, 1], 1], ["SP", 3, 10, 7, [1, 1, 1, 1], 1], ["SP", 3, 15, 512, [1, 32, 1, 1], 1], ["SP", 3, 20, 3, [1, 3], 1], ["SP", 3, 23, 3, [1, 1], 1], ["SP", 3, 26, 512, [4, 16], 1], ["RE", 3, [0, 5, 10, 15, 1, 6, 11, 16, 2, 7, 12, 17, 20, 23, 26, 21, 24, 27, 3, 8, 13, 18, 22, 25, 28, 4, 9, 14, 19]], ["FSP", 10, 0, 3, 3], ["FSP", 10, 4, 4, 3], ["FSP", 10, 8, 5, 3], ["FSP", 10, 12, 6, 3], ["RE", 10, [0, 4, 8, 12, 1, 5, 9, 13, 2, 6, 10, 14, 3, 7, 11, 15]], ["CA", 3, 10, 11], ["CHR", 2, "shared", [3]], ["CA", 3, 4, 14], ["CHR", 1, "shared", [4]], ["CA", 2, 5, 14], ["CI", 1], ["FU", 12, [0, 1, 2, 3]], ["AN", 12, 0, 5], ["FU", 12, [1, 2, 3, 4]], ["AN", 12, 1, 4], ["FU", 12, [2, 3, 4, 5]], ["AN", 12, 2, 6], ["FU", 2, [0, 1, 2, 3]], ["SP", 2, 0, 168, [1], 1], ["AN", 2, 1, 2], ["FFSP", 2, 0, [6, 5, 4, 3], 1, 1], ["AN", 2, 1, 6], ["FU", 4, [0, 1, 2, 3]], ["SP", 4, 0, 24, [1], 1], ["AN", 4, 1, 2], ["FFSP", 4, 0, [6, 5, 4, 3], 1, 1], ["AN", 4, 1, 6], ["PR", 5, 0, "auto_unroll_max_step$1024"]]]], "r": [[9.38207e-05], 0, 3.02271, 1593675837], "v": "v0.2"}
{"i": [["[\"conv2d_nhwc_bn_relu\", 16, 7, 7, 512, 512, 3, 1, 1]", "cuda"], [[], [["CI", 9], ["CI", 7], ["CI", 5], ["SP", 3, 0, 16, [1, 1, 1, 2], 1], ["SP", 3, 5, 7, [1, 7, 1, 1], 1], ["SP", 3, 10, 7, [1, 1, 7, 1], 1], ["SP", 3, 15, 512, [1, 8, 1, 2], 1], ["SP", 3, 20, 3, [3, 1], 1], ["SP", 3, 23, 3, [1, 3], 1], ["SP", 3, 26, 512, [1, 4], 1], ["RE", 3, [0, 5, 10, 15, 1, 6, 11, 16, 2, 7, 12, 17, 20, 23, 26, 21, 24, 27, 3, 8, 13, 18, 22, 25, 28, 4, 9, 14, 19]], ["FSP", 10, 0, 3, 3], ["FSP", 10, 4, 4, 3], ["FSP", 10, 8, 5, 3], ["FSP", 10, 12, 6, 3], ["RE", 10, [0, 4, 8, 12, 1, 5, 9, 13, 2, 6, 10, 14, 3, 7, 11, 15]], ["CA", 3, 10, 11], ["CHR", 2, "shared", [3]], ["CA", 3, 4, 14], ["CHR", 1, "shared", [4]], ["CA", 2, 5, 14], ["CI", 1], ["FU", 12, [0, 1, 2, 3]], ["AN", 12, 0, 5], ["FU", 12, [1, 2, 3, 4]], ["AN", 12, 1, 4], ["FU", 12, [2, 3, 4, 5]], ["AN", 12, 2, 6], ["FU", 2, [0, 1, 2, 3]], ["SP", 2, 0, 108, [1], 1], ["AN", 2, 1, 2], ["FFSP", 2, 0, [6, 5, 4, 3], 1, 1], ["AN", 2, 1, 6], ["FU", 4, [0, 1, 2, 3]], ["SP", 4, 0, 36, [1], 1], ["AN", 4, 1, 2], ["FFSP", 4, 0, [6, 5, 4, 3], 1, 1], ["AN", 4, 1, 6], ["PR", 5, 0, "auto_unroll_max_step$512"]]]], "r": [[0.00041888], 0, 3.13881, 1593674057], "v": "v0.2"}
{"i": [["[\"transpose_batch_matmul\", 1, 128, 12, 64]", "cuda"], [[], [["CHW", 4, "local"], ["SP", 4, 0, 1, [1, 1, 1, 1], 1], ["SP", 4, 5, 12, [1, 1, 1, 1], 1], ["SP", 4, 10, 128, [2, 8, 2, 1], 1], ["SP", 4, 15, 128, [2, 16, 1, 1], 1], ["SP", 4, 20, 64, [8, 4], 1], ["RE", 4, [0, 5, 10, 15, 1, 6, 11, 16, 2, 7, 12, 17, 20, 21, 3, 8, 13, 18, 22, 4, 9, 14, 19]], ["FSP", 5, 0, 1, 3], ["FSP", 5, 4, 2, 3], ["FSP", 5, 8, 3, 3], ["FSP", 5, 12, 4, 3], ["RE", 5, [0, 4, 8, 12, 1, 5, 9, 13, 2, 6, 10, 14, 3, 7, 11, 15]], ["CA", 4, 5, 11], ["CHR", 3, "shared", [4]], ["CA", 4, 5, 12], ["CI", 3], ["CHR", 1, "shared", [5]], ["CA", 2, 6, 12], ["CI", 1], ["FU", 7, [0, 1, 2, 3]], ["AN", 7, 0, 5], ["FU", 7, [1, 2, 3, 4]], ["AN", 7, 1, 4], ["FU", 7, [2, 3, 4, 5]], ["AN", 7, 2, 6], ["FU", 2, [0, 1, 2, 3]], ["SP", 2, 0, 16, [4], 1], ["AN", 2, 1, 2], ["FFSP", 2, 0, [4, 3, 2, 1], 1, 1], ["AN", 2, 1, 6], ["FU", 5, [0, 1, 2, 3]], ["SP", 5, 0, 16, [4], 1], ["AN", 5, 1, 2], ["FFSP", 5, 0, [4, 3, 2, 1], 1, 1], ["AN", 5, 1, 6], ["PR", 6, 0, "auto_unroll_max_step$1024"]]]], "r": [[5.89707e-06], 0, 2.45914, 1593716489], "v": "v0.2"}
{"i": [["[\"transpose_batch_matmul\", 16, 128, 12, 64]", "cuda"], [[], [["CHW", 4, "local"], ["SP", 4, 0, 16, [1, 1, 1, 1], 1], ["SP", 4, 5, 12, [1, 1, 1, 1], 1], ["SP", 4, 10, 128, [1, 8, 4, 4], 1], ["SP", 4, 15, 128, [2, 16, 1, 1], 1], ["SP", 4, 20, 64, [4, 8], 1], ["RE", 4, [0, 5, 10, 15, 1, 6, 11, 16, 2, 7, 12, 17, 20, 21, 3, 8, 13, 18, 22, 4, 9, 14, 19]], ["FSP", 5, 0, 1, 3], ["FSP", 5, 4, 2, 3], ["FSP", 5, 8, 3, 3], ["FSP", 5, 12, 4, 3], ["RE", 5, [0, 4, 8, 12, 1, 5, 9, 13, 2, 6, 10, 14, 3, 7, 11, 15]], ["CA", 4, 5, 11], ["CHR", 3, "shared", [4]], ["CA", 4, 5, 12], ["CI", 3], ["CHR", 1, "shared", [5]], ["CA", 2, 6, 12], ["CI", 1], ["FU", 7, [0, 1, 2, 3]], ["AN", 7, 0, 5], ["FU", 7, [1, 2, 3, 4]], ["AN", 7, 1, 4], ["FU", 7, [2, 3, 4, 5]], ["AN", 7, 2, 6], ["FU", 2, [0, 1, 2, 3]], ["SP", 2, 0, 16, [4], 1], ["AN", 2, 1, 2], ["FFSP", 2, 0, [4, 3, 2, 1], 1, 1], ["AN", 2, 1, 6], ["FU", 5, [0, 1, 2, 3]], ["SP", 5, 0, 64, [4], 1], ["AN", 5, 1, 2], ["FFSP", 5, 0, [4, 3, 2, 1], 1, 1], ["AN", 5, 1, 6], ["PR", 6, 0, "auto_unroll_max_step$512"]]]], "r": [[4.54895e-05], 0, 3.54234, 1593718510], "v": "v0.2"}
{"i": [["[\"transpose_batch_matmul\", 1, 128, 16, 64]", "cuda"], [[], [["CHW", 4, "local"], ["SP", 4, 0, 1, [1, 1, 1, 1], 1], ["SP", 4, 5, 16, [1, 1, 1, 1], 1], ["SP", 4, 10, 128, [4, 8, 1, 2], 1], ["SP", 4, 15, 128, [2, 16, 1, 1], 1], ["SP", 4, 20, 64, [8, 4], 1], ["RE", 4, [0, 5, 10, 15, 1, 6, 11, 16, 2, 7, 12, 17, 20, 21, 3, 8, 13, 18, 22, 4, 9, 14, 19]], ["FSP", 5, 0, 1, 3], ["FSP", 5, 4, 2, 3], ["FSP", 5, 8, 3, 3], ["FSP", 5, 12, 4, 3], ["RE", 5, [0, 4, 8, 12, 1, 5, 9, 13, 2, 6, 10, 14, 3, 7, 11, 15]], ["CA", 4, 5, 11], ["CHR", 3, "shared", [4]], ["CA", 4, 5, 12], ["CI", 3], ["CHR", 1, "shared", [5]], ["CA", 2, 6, 12], ["CI", 1], ["FU", 7, [0, 1, 2, 3]], ["AN", 7, 0, 5], ["FU", 7, [1, 2, 3, 4]], ["AN", 7, 1, 4], ["FU", 7, [2, 3, 4, 5]], ["AN", 7, 2, 6], ["FU", 2, [0, 1, 2, 3]], ["SP", 2, 0, 16, [1], 1], ["AN", 2, 1, 2], ["FFSP", 2, 0, [4, 3, 2, 1], 1, 1], ["AN", 2, 1, 6], ["FU", 5, [0, 1, 2, 3]], ["SP", 5, 0, 16, [4], 1], ["AN", 5, 1, 2], ["FFSP", 5, 0, [4, 3, 2, 1], 1, 1], ["AN", 5, 1, 6], ["PR", 6, 0, "auto_unroll_max_step$64"]]]], "r": [[6.60357e-06], 0, 2.06029, 1593720630], "v": "v0.2"}
{"i": [["[\"transpose_batch_matmul\", 16, 128, 16, 64]", "cuda"], [[], [["CHW", 4, "local"], ["SP", 4, 0, 16, [1, 1, 1, 1], 1], ["SP", 4, 5, 16, [1, 1, 1, 1], 1], ["SP", 4, 10, 128, [1, 8, 8, 2], 1], ["SP", 4, 15, 128, [2, 16, 1, 1], 1], ["SP", 4, 20, 64, [2, 8], 1], ["RE", 4, [0, 5, 10, 15, 1, 6, 11, 16, 2, 7, 12, 17, 20, 21, 3, 8, 13, 18, 22, 4, 9, 14, 19]], ["FSP", 5, 0, 1, 3], ["FSP", 5, 4, 2, 3], ["FSP", 5, 8, 3, 3], ["FSP", 5, 12, 4, 3], ["RE", 5, [0, 4, 8, 12, 1, 5, 9, 13, 2, 6, 10, 14, 3, 7, 11, 15]], ["CA", 4, 5, 11], ["CHR", 3, "shared", [4]], ["CA", 4, 5, 12], ["CI", 3], ["CHR", 1, "shared", [5]], ["CA", 2, 6, 12], ["CI", 1], ["FU", 7, [0, 1, 2, 3]], ["AN", 7, 0, 5], ["FU", 7, [1, 2, 3, 4]], ["AN", 7, 1, 4], ["FU", 7, [2, 3, 4, 5]], ["AN", 7, 2, 6], ["FU", 2, [0, 1, 2, 3]], ["SP", 2, 0, 2048, [4], 1], ["AN", 2, 1, 2], ["FFSP", 2, 0, [4, 3, 2, 1], 1, 1], ["AN", 2, 1, 6], ["FU", 5, [0, 1, 2, 3]], ["SP", 5, 0, 64, [4], 1], ["AN", 5, 1, 2], ["FFSP", 5, 0, [4, 3, 2, 1], 1, 1], ["AN", 5, 1, 6], ["PR", 6, 0, "auto_unroll_max_step$1024"]]]], "r": [[5.7188e-05], 0, 3.53922, 1593720790], "v": "v0.2"}
{"i": [["[\"transpose_batch_matmul\", 1, 64, 12, 128]", "cuda"], [[], [["CHW", 4, "local"], ["SP", 4, 0, 1, [1, 1, 1, 1], 1], ["SP", 4, 5, 12, [1, 1, 1, 1], 1], ["SP", 4, 10, 64, [1, 8, 2, 1], 1], ["SP", 4, 15, 64, [1, 16, 1, 1], 1], ["SP", 4, 20, 128, [1, 64], 1], ["RE", 4, [0, 5, 10, 15, 1, 6, 11, 16, 2, 7, 12, 17, 20, 21, 3, 8, 13, 18, 22, 4, 9, 14, 19]], ["FSP", 5, 0, 1, 3], ["FSP", 5, 4, 2, 3], ["FSP", 5, 8, 3, 3], ["FSP", 5, 12, 4, 3], ["RE", 5, [0, 4, 8, 12, 1, 5, 9, 13, 2, 6, 10, 14, 3, 7, 11, 15]], ["CA", 4, 5, 11], ["CHR", 3, "shared", [4]], ["CA", 4, 5, 12], ["CI", 3], ["CHR", 1, "shared", [5]], ["CA", 2, 6, 12], ["CI", 1], ["FU", 7, [0, 1, 2, 3]], ["AN", 7, 0, 5], ["FU", 7, [1, 2, 3, 4]], ["AN", 7, 1, 4], ["FU", 7, [2, 3, 4, 5]], ["AN", 7, 2, 6], ["FU", 2, [0, 1, 2, 3]], ["SP", 2, 0, 32, [4], 1], ["AN", 2, 1, 2], ["FFSP", 2, 0, [4, 3, 2, 1], 1, 1], ["AN", 2, 1, 6], ["FU", 5, [0, 1, 2, 3]], ["SP", 5, 0, 32, [4], 1], ["AN", 5, 1, 2], ["FFSP", 5, 0, [4, 3, 2, 1], 1, 1], ["AN", 5, 1, 6], ["PR", 6, 0, "auto_unroll_max_step$1024"]]]], "r": [[5.24842e-06], 0, 1.94224, 1593704798], "v": "v0.2"}
{"i": [["[\"transpose_batch_matmul\", 16, 64, 12, 128]", "cuda"], [[], [["CHW", 4, "local"], ["SP", 4, 0, 16, [1, 1, 1, 1], 1], ["SP", 4, 5, 12, [1, 1, 1, 1], 1], ["SP", 4, 10, 64, [1, 8, 4, 2], 1], ["SP", 4, 15, 64, [2, 16, 1, 1], 1], ["SP", 4, 20, 128, [4, 4], 1], ["RE", 4, [0, 5, 10, 15, 1, 6, 11, 16, 2, 7, 12, 17, 20, 21, 3, 8, 13, 18, 22, 4, 9, 14, 19]], ["FSP", 5, 0, 1, 3], ["FSP", 5, 4, 2, 3], ["FSP", 5, 8, 3, 3], ["FSP", 5, 12, 4, 3], ["RE", 5, [0, 4, 8, 12, 1, 5, 9, 13, 2, 6, 10, 14, 3, 7, 11, 15]], ["CA", 4, 5, 11], ["CHR", 3, "shared", [4]], ["CA", 4, 5, 12], ["CI", 3], ["CHR", 1, "shared", [5]], ["CA", 2, 6, 12], ["CI", 1], ["FU", 7, [0, 1, 2, 3]], ["AN", 7, 0, 5], ["FU", 7, [1, 2, 3, 4]], ["AN", 7, 1, 4], ["FU", 7, [2, 3, 4, 5]], ["AN", 7, 2, 6], ["FU", 2, [0, 1, 2, 3]], ["SP", 2, 0, 16, [1], 1], ["AN", 2, 1, 2], ["FFSP", 2, 0, [4, 3, 2, 1], 1, 1], ["AN", 2, 1, 6], ["FU", 5, [0, 1, 2, 3]], ["SP", 5, 0, 4, [4], 1], ["AN", 5, 1, 2], ["FFSP", 5, 0, [4, 3, 2, 1], 1, 1], ["AN", 5, 1, 6], ["PR", 6, 0, "auto_unroll_max_step$64"]]]], "r": [[2.82296e-05], 0, 2.66272, 1593719491], "v": "v0.2"}
{"i": [["[\"transpose_batch_matmul\", 1, 128, 12, 128]", "cuda"], [[], [["CHW", 4, "local"], ["SP", 4, 0, 1, [1, 1, 1, 1], 1], ["SP", 4, 5, 12, [1, 1, 1, 1], 1], ["SP", 4, 10, 128, [1, 8, 2, 2], 1], ["SP", 4, 15, 128, [2, 16, 1, 1], 1], ["SP", 4, 20, 128, [4, 32], 1], ["RE", 4, [0, 5, 10, 15, 1, 6, 11, 16, 2, 7, 12, 17, 20, 21, 3, 8, 13, 18, 22, 4, 9, 14, 19]], ["FSP", 5, 0, 1, 3], ["FSP", 5, 4, 2, 3], ["FSP", 5, 8, 3, 3], ["FSP", 5, 12, 4, 3], ["RE", 5, [0, 4, 8, 12, 1, 5, 9, 13, 2, 6, 10, 14, 3, 7, 11, 15]], ["CA", 4, 5, 11], ["CHR", 3, "shared", [4]], ["CA", 4, 5, 12], ["CI", 3], ["CHR", 1, "shared", [5]], ["CA", 2, 6, 12], ["CI", 1], ["FU", 7, [0, 1, 2, 3]], ["AN", 7, 0, 5], ["FU", 7, [1, 2, 3, 4]], ["AN", 7, 1, 4], ["FU", 7, [2, 3, 4, 5]], ["AN", 7, 2, 6], ["FU", 2, [0, 1, 2, 3]], ["SP", 2, 0, 96, [4], 1], ["AN", 2, 1, 2], ["FFSP", 2, 0, [4, 3, 2, 1], 1, 1], ["AN", 2, 1, 6], ["FU", 5, [0, 1, 2, 3]], ["SP", 5, 0, 96, [4], 1], ["AN", 5, 1, 2], ["FFSP", 5, 0, [4, 3, 2, 1], 1, 1], ["AN", 5, 1, 6], ["PR", 6, 0, "auto_unroll_max_step$512"]]]], "r": [[9.97988e-06], 0, 2.42805, 1593706995], "v": "v0.2"}
{"i": [["[\"transpose_batch_matmul\", 16, 128, 12, 128]", "cuda"], [[], [["CHW", 4, "local"], ["SP", 4, 0, 16, [1, 1, 2, 1], 1], ["SP", 4, 5, 12, [1, 1, 1, 4], 1], ["SP", 4, 10, 128, [2, 16, 1, 2], 1], ["SP", 4, 15, 128, [1, 8, 1, 1], 1], ["SP", 4, 20, 128, [8, 1], 1], ["RE", 4, [0, 5, 10, 15, 1, 6, 11, 16, 2, 7, 12, 17, 20, 21, 3, 8, 13, 18, 22, 4, 9, 14, 19]], ["FSP", 5, 0, 1, 3], ["FSP", 5, 4, 2, 3], ["FSP", 5, 8, 3, 3], ["FSP", 5, 12, 4, 3], ["RE", 5, [0, 4, 8, 12, 1, 5, 9, 13, 2, 6, 10, 14, 3, 7, 11, 15]], ["CA", 4, 5, 11], ["CHR", 3, "shared", [4]], ["CA", 4, 5, 12], ["CI", 3], ["CHR", 1, "shared", [5]], ["CA", 2, 6, 12], ["CI", 1], ["FU", 7, [0, 1, 2, 3]], ["AN", 7, 0, 5], ["FU", 7, [1, 2, 3, 4]], ["AN", 7, 1, 4], ["FU", 7, [2, 3, 4, 5]], ["AN", 7, 2, 6], ["FU", 2, [0, 1, 2, 3]], ["SP", 2, 0, 8, [1], 1], ["AN", 2, 1, 2], ["FFSP", 2, 0, [4, 3, 2, 1], 1, 1], ["AN", 2, 1, 6], ["FU", 5, [0, 1, 2, 3]], ["SP", 5, 0, 32, [2], 1], ["AN", 5, 1, 2], ["FFSP", 5, 0, [4, 3, 2, 1], 1, 1], ["AN", 5, 1, 6], ["PR", 6, 0, "auto_unroll_max_step$512"]]]], "r": [[0.000203779], 0, 4.08572, 1593719883], "v": "v0.2"}
{"i": [["[\"transpose_batch_matmul_softmax\", 1, 128, 12, 64]", "cuda"], [[], [["SP", 9, 3, 128, [64], 1], ["AN", 9, 4, 6], ["FSP", 8, 3, 0, 1], ["AN", 8, 4, 6], ["CA", 8, 9, 2], ["CI", 7], ["CI", 6], ["FSP", 5, 3, 0, 1], ["AN", 5, 4, 6], ["CA", 5, 9, 2], ["CHW", 4, "local"], ["SP", 4, 0, 1, [1, 1, 1, 1], 1], ["SP", 4, 5, 12, [1, 1, 1, 1], 1], ["SP", 4, 10, 128, [1, 8, 1, 4], 1], ["SP", 4, 15, 128, [1, 16, 1, 1], 1], ["SP", 4, 20, 64, [4, 8], 1], ["RE", 4, [0, 5, 10, 15, 1, 6, 11, 16, 2, 7, 12, 17, 20, 21, 3, 8, 13, 18, 22, 4, 9, 14, 19]], ["FSP", 5, 0, 11, 3], ["FSP", 5, 4, 12, 3], ["FSP", 5, 8, 13, 3], ["FSP", 5, 12, 14, 3], ["RE", 5, [0, 4, 8, 12, 1, 5, 9, 13, 2, 6, 10, 14, 3, 7, 11, 15]], ["CA", 4, 5, 11], ["CHR", 3, "shared", [4]], ["CA", 4, 5, 12], ["CI", 3], ["CHR", 1, "shared", [5]], ["CA", 2, 6, 12], ["CI", 1], ["FU", 7, [0, 1, 2, 3]], ["AN", 7, 0, 5], ["FU", 7, [1, 2, 3, 4]], ["AN", 7, 1, 4], ["FU", 7, [2, 3, 4, 5]], ["AN", 7, 2, 6], ["FU", 12, [0, 1, 2]], ["AN", 12, 0, 5], ["FU", 2, [0, 1, 2, 3]], ["SP", 2, 0, 768, [4], 1], ["AN", 2, 1, 2], ["FFSP", 2, 0, [14, 13, 12, 11], 1, 1], ["AN", 2, 1, 6], ["FU", 5, [0, 1, 2, 3]], ["SP", 5, 0, 192, [4], 1], ["AN", 5, 1, 2], ["FFSP", 5, 0, [14, 13, 12, 11], 1, 1], ["AN", 5, 1, 6], ["PR", 6, 0, "auto_unroll_max_step$512"]]]], "r": [[1.15755e-05], 0, 2.27893, 1594592854], "v": "v0.2"}
{"i": [["[\"transpose_batch_matmul_softmax\", 16, 128, 12, 64]", "cuda"], [[], [["SP", 9, 3, 128, [64], 1], ["AN", 9, 4, 6], ["FSP", 8, 3, 0, 1], ["AN", 8, 4, 6], ["CA", 8, 9, 2], ["CI", 7], ["CI", 6], ["CHW", 4, "local"], ["SP", 4, 0, 16, [1, 1, 1, 1], 1], ["SP", 4, 5, 12, [1, 1, 1, 1], 1], ["SP", 4, 10, 128, [1, 32, 2, 1], 1], ["SP", 4, 15, 128, [2, 8, 1, 2], 1], ["SP", 4, 20, 64, [32, 2], 1], ["RE", 4, [0, 5, 10, 15, 1, 6, 11, 16, 2, 7, 12, 17, 20, 21, 3, 8, 13, 18, 22, 4, 9, 14, 19]], ["FSP", 5, 0, 8, 3], ["FSP", 5, 4, 9, 3], ["FSP", 5, 8, 10, 3], ["FSP", 5, 12, 11, 3], ["RE", 5, [0, 4, 8, 12, 1, 5, 9, 13, 2, 6, 10, 14, 3, 7, 11, 15]], ["CA", 4, 5, 11], ["CHR", 3, "shared", [4]], ["CA", 4, 5, 12], ["CI", 3], ["CHR", 1, "shared", [5]], ["CA", 2, 6, 12], ["CI", 1], ["FU", 7, [0, 1, 2, 3]], ["AN", 7, 0, 5], ["FU", 7, [1, 2, 3, 4]], ["AN", 7, 1, 4], ["FU", 7, [2, 3, 4, 5]], ["AN", 7, 2, 6], ["FU", 8, [0, 1, 2]], ["SP", 8, 0, 24576, [16, 1], 1], ["AN", 8, 0, 5], ["AN", 8, 1, 6], ["FU", 12, [0, 1, 2]], ["AN", 12, 0, 5], ["FU", 2, [0, 1, 2, 3]], ["SP", 2, 0, 8, [4], 1], ["AN", 2, 1, 2], ["FFSP", 2, 0, [11, 10, 9, 8], 1, 1], ["AN", 2, 1, 6], ["FU", 5, [0, 1, 2, 3]], ["SP", 5, 0, 64, [16], 1], ["AN", 5, 1, 2], ["FFSP", 5, 0, [11, 10, 9, 8], 1, 1], ["AN", 5, 1, 6], ["PR", 6, 0, "auto_unroll_max_step$512"]]]], "r": [[0.000132243], 0, 4.00215, 1594598153], "v": "v0.2"}
{"i": [["[\"transpose_batch_matmul_softmax\", 1, 128, 16, 64]", "cuda"], [[], [["SP", 9, 3, 128, [64], 1], ["AN", 9, 4, 6], ["FSP", 8, 3, 0, 1], ["AN", 8, 4, 6], ["CA", 8, 9, 2], ["CI", 7], ["CI", 6], ["FSP", 5, 3, 0, 1], ["AN", 5, 4, 6], ["CA", 5, 9, 2], ["CHW", 4, "local"], ["SP", 4, 0, 1, [1, 1, 1, 1], 1], ["SP", 4, 5, 16, [1, 1, 1, 1], 1], ["SP", 4, 10, 128, [1, 8, 2, 2], 1], ["SP", 4, 15, 128, [2, 16, 1, 1], 1], ["SP", 4, 20, 64, [1, 32], 1], ["RE", 4, [0, 5, 10, 15, 1, 6, 11, 16, 2, 7, 12, 17, 20, 21, 3, 8, 13, 18, 22, 4, 9, 14, 19]], ["FSP", 5, 0, 11, 3], ["FSP", 5, 4, 12, 3], ["FSP", 5, 8, 13, 3], ["FSP", 5, 12, 14, 3], ["RE", 5, [0, 4, 8, 12, 1, 5, 9, 13, 2, 6, 10, 14, 3, 7, 11, 15]], ["CA", 4, 5, 11], ["CHR", 3, "shared", [4]], ["CA", 4, 5, 12], ["CI", 3], ["CHR", 1, "shared", [5]], ["CA", 2, 6, 12], ["CI", 1], ["FU", 7, [0, 1, 2, 3]], ["AN", 7, 0, 5], ["FU", 7, [1, 2, 3, 4]], ["AN", 7, 1, 4], ["FU", 7, [2, 3, 4, 5]], ["AN", 7, 2, 6], ["FU", 12, [0, 1, 2]], ["AN", 12, 0, 5], ["FU", 2, [0, 1, 2, 3]], ["SP", 2, 0, 32, [4], 1], ["AN", 2, 1, 2], ["FFSP", 2, 0, [14, 13, 12, 11], 1, 1], ["AN", 2, 1, 6], ["FU", 5, [0, 1, 2, 3]], ["SP", 5, 0, 8, [4], 1], ["AN", 5, 1, 2], ["FFSP", 5, 0, [14, 13, 12, 11], 1, 1], ["AN", 5, 1, 6], ["PR", 6, 0, "auto_unroll_max_step$1024"]]]], "r": [[1.33316e-05], 0, 2.69493, 1594581185], "v": "v0.2"}
{"i": [["[\"transpose_batch_matmul_softmax\", 16, 128, 16, 64]", "cuda"], [[], [["SP", 9, 3, 128, [64], 1], ["AN", 9, 4, 6], ["FSP", 8, 3, 0, 1], ["AN", 8, 4, 6], ["CA", 8, 9, 2], ["CI", 7], ["CI", 6], ["FSP", 5, 3, 0, 1], ["AN", 5, 4, 6], ["CA", 5, 9, 2], ["CHW", 4, "local"], ["SP", 4, 0, 16, [1, 1, 1, 1], 1], ["SP", 4, 5, 16, [1, 1, 1, 1], 1], ["SP", 4, 10, 128, [1, 16, 2, 4], 1], ["SP", 4, 15, 128, [2, 16, 1, 1], 1], ["SP", 4, 20, 64, [16, 2], 1], ["RE", 4, [0, 5, 10, 15, 1, 6, 11, 16, 2, 7, 12, 17, 20, 21, 3, 8, 13, 18, 22, 4, 9, 14, 19]], ["FSP", 5, 0, 11, 3], ["FSP", 5, 4, 12, 3], ["FSP", 5, 8, 13, 3], ["FSP", 5, 12, 14, 3], ["RE", 5, [0, 4, 8, 12, 1, 5, 9, 13, 2, 6, 10, 14, 3, 7, 11, 15]], ["CA", 4, 5, 11], ["CHR", 3, "shared", [4]], ["CA", 4, 5, 12], ["CI", 3], ["CHR", 1, "shared", [5]], ["CA", 2, 6, 12], ["CI", 1], ["FU", 7, [0, 1, 2, 3]], ["AN", 7, 0, 5], ["FU", 7, [1, 2, 3, 4]], ["AN", 7, 1, 4], ["FU", 7, [2, 3, 4, 5]], ["AN", 7, 2, 6], ["FU", 12, [0, 1, 2]], ["AN", 12, 0, 5], ["FU", 2, [0, 1, 2, 3]], ["SP", 2, 0, 64, [2], 1], ["AN", 2, 1, 2], ["FFSP", 2, 0, [14, 13, 12, 11], 1, 1], ["AN", 2, 1, 6], ["FU", 5, [0, 1, 2, 3]], ["SP", 5, 0, 64, [4], 1], ["AN", 5, 1, 2], ["FFSP", 5, 0, [14, 13, 12, 11], 1, 1], ["AN", 5, 1, 6], ["PR", 6, 0, "auto_unroll_max_step$16"]]]], "r": [[0.000110205], 0, 2.94923, 1594588836], "v": "v0.2"}
{"i": [["[\"transpose_batch_matmul_softmax\", 1, 64, 12, 128]", "cuda"], [[], [["SP", 9, 3, 64, [64], 1], ["AN", 9, 4, 6], ["FSP", 8, 3, 0, 1], ["AN", 8, 4, 6], ["CA", 8, 9, 2], ["CI", 7], ["CI", 6], ["FSP", 5, 3, 0, 1], ["AN", 5, 4, 6], ["CA", 5, 9, 2], ["CHW", 4, "local"], ["SP", 4, 0, 1, [1, 1, 1, 1], 1], ["SP", 4, 5, 12, [1, 1, 1, 1], 1], ["SP", 4, 10, 64, [1, 16, 2, 2], 1], ["SP", 4, 15, 64, [1, 16, 1, 1], 1], ["SP", 4, 20, 128, [32, 4], 1], ["RE", 4, [0, 5, 10, 15, 1, 6, 11, 16, 2, 7, 12, 17, 20, 21, 3, 8, 13, 18, 22, 4, 9, 14, 19]], ["FSP", 5, 0, 11, 3], ["FSP", 5, 4, 12, 3], ["FSP", 5, 8, 13, 3], ["FSP", 5, 12, 14, 3], ["RE", 5, [0, 4, 8, 12, 1, 5, 9, 13, 2, 6, 10, 14, 3, 7, 11, 15]], ["CA", 4, 5, 11], ["CHR", 3, "shared", [4]], ["CA", 4, 5, 12], ["CI", 3], ["CHR", 1, "shared", [5]], ["CA", 2, 6, 12], ["CI", 1], ["FU", 7, [0, 1, 2, 3]], ["AN", 7, 0, 5], ["FU", 7, [1, 2, 3, 4]], ["AN", 7, 1, 4], ["FU", 7, [2, 3, 4, 5]], ["AN", 7, 2, 6], ["FU", 12, [0, 1, 2]], ["AN", 12, 0, 5], ["FU", 2, [0, 1, 2, 3]], ["SP", 2, 0, 128, [4], 1], ["AN", 2, 1, 2], ["FFSP", 2, 0, [14, 13, 12, 11], 1, 1], ["AN", 2, 1, 6], ["FU", 5, [0, 1, 2, 3]], ["SP", 5, 0, 256, [4], 1], ["AN", 5, 1, 2], ["FFSP", 5, 0, [14, 13, 12, 11], 1, 1], ["AN", 5, 1, 6], ["PR", 6, 0, "auto_unroll_max_step$512"]]]], "r": [[8.96522e-06], 0, 2.68071, 1594579354], "v": "v0.2"}
{"i": [["[\"transpose_batch_matmul_softmax\", 16, 64, 12, 128]", "cuda"], [[], [["SP", 9, 3, 64, [64], 1], ["AN", 9, 4, 6], ["FSP", 8, 3, 0, 1], ["AN", 8, 4, 6], ["CA", 8, 9, 2], ["CI", 7], ["CI", 6], ["CHW", 4, "local"], ["SP", 4, 0, 16, [1, 1, 1, 1], 1], ["SP", 4, 5, 12, [1, 1, 1, 1], 1], ["SP", 4, 10, 64, [1, 4, 16, 1], 1], ["SP", 4, 15, 64, [2, 32, 1, 1], 1], ["SP", 4, 20, 128, [1, 16], 1], ["RE", 4, [0, 5, 10, 15, 1, 6, 11, 16, 2, 7, 12, 17, 20, 21, 3, 8, 13, 18, 22, 4, 9, 14, 19]], ["FSP", 5, 0, 8, 3], ["FSP", 5, 4, 9, 3], ["FSP", 5, 8, 10, 3], ["FSP", 5, 12, 11, 3], ["RE", 5, [0, 4, 8, 12, 1, 5, 9, 13, 2, 6, 10, 14, 3, 7, 11, 15]], ["CA", 4, 5, 11], ["CHR", 3, "shared", [4]], ["CA", 4, 5, 12], ["CI", 3], ["CHR", 1, "shared", [5]], ["CA", 2, 6, 12], ["CI", 1], ["FU", 7, [0, 1, 2, 3]], ["AN", 7, 0, 5], ["FU", 7, [1, 2, 3, 4]], ["AN", 7, 1, 4], ["FU", 7, [2, 3, 4, 5]], ["AN", 7, 2, 6], ["FU", 8, [0, 1, 2]], ["SP", 8, 0, 12288, [16, 1], 1], ["AN", 8, 0, 5], ["AN", 8, 1, 6], ["FU", 12, [0, 1, 2]], ["AN", 12, 0, 5], ["FU", 2, [0, 1, 2, 3]], ["SP", 2, 0, 256, [4], 1], ["AN", 2, 1, 2], ["FFSP", 2, 0, [11, 10, 9, 8], 1, 1], ["AN", 2, 1, 6], ["FU", 5, [0, 1, 2, 3]], ["SP", 5, 0, 128, [4], 1], ["AN", 5, 1, 2], ["FFSP", 5, 0, [11, 10, 9, 8], 1, 1], ["AN", 5, 1, 6], ["PR", 6, 0, "auto_unroll_max_step$512"]]]], "r": [[6.1462e-05], 0, 3.5594, 1594582001], "v": "v0.2"}
{"i": [["[\"transpose_batch_matmul_softmax\", 1, 128, 12, 128]", "cuda"], [[], [["SP", 9, 3, 128, [64], 1], ["AN", 9, 4, 6], ["FSP", 8, 3, 0, 1], ["AN", 8, 4, 6], ["CA", 8, 9, 2], ["CI", 7], ["CI", 6], ["FSP", 5, 3, 0, 1], ["AN", 5, 4, 6], ["CA", 5, 9, 2], ["CHW", 4, "local"], ["SP", 4, 0, 1, [1, 1, 1, 1], 1], ["SP", 4, 5, 12, [1, 1, 1, 1], 1], ["SP", 4, 10, 128, [1, 8, 2, 2], 1], ["SP", 4, 15, 128, [1, 16, 1, 1], 1], ["SP", 4, 20, 128, [2, 16], 1], ["RE", 4, [0, 5, 10, 15, 1, 6, 11, 16, 2, 7, 12, 17, 20, 21, 3, 8, 13, 18, 22, 4, 9, 14, 19]], ["FSP", 5, 0, 11, 3], ["FSP", 5, 4, 12, 3], ["FSP", 5, 8, 13, 3], ["FSP", 5, 12, 14, 3], ["RE", 5, [0, 4, 8, 12, 1, 5, 9, 13, 2, 6, 10, 14, 3, 7, 11, 15]], ["CA", 4, 5, 11], ["CHR", 3, "shared", [4]], ["CA", 4, 5, 12], ["CI", 3], ["CHR", 1, "shared", [5]], ["CA", 2, 6, 12], ["CI", 1], ["FU", 7, [0, 1, 2, 3]], ["AN", 7, 0, 5], ["FU", 7, [1, 2, 3, 4]], ["AN", 7, 1, 4], ["FU", 7, [2, 3, 4, 5]], ["AN", 7, 2, 6], ["FU", 12, [0, 1, 2]], ["AN", 12, 0, 5], ["FU", 2, [0, 1, 2, 3]], ["SP", 2, 0, 16, [2], 1], ["AN", 2, 1, 2], ["FFSP", 2, 0, [14, 13, 12, 11], 1, 1], ["AN", 2, 1, 6], ["FU", 5, [0, 1, 2, 3]], ["SP", 5, 0, 4, [4], 1], ["AN", 5, 1, 2], ["FFSP", 5, 0, [14, 13, 12, 11], 1, 1], ["AN", 5, 1, 6], ["PR", 6, 0, "auto_unroll_max_step$1024"]]]], "r": [[1.54016e-05], 0, 2.80364, 1594592169], "v": "v0.2"}
{"i": [["[\"transpose_batch_matmul_softmax\", 16, 128, 12, 128]", "cuda"], [[], [["SP", 9, 3, 128, [64], 1], ["AN", 9, 4, 6], ["FSP", 8, 3, 0, 1], ["AN", 8, 4, 6], ["CA", 8, 9, 2], ["CI", 7], ["CI", 6], ["FSP", 5, 3, 0, 1], ["AN", 5, 4, 6], ["CA", 5, 9, 2], ["CHW", 4, "local"], ["SP", 4, 0, 16, [1, 1, 1, 1], 1], ["SP", 4, 5, 12, [1, 1, 1, 1], 1], ["SP", 4, 10, 128, [1, 32, 1, 4], 1], ["SP", 4, 15, 128, [2, 8, 1, 2], 1], ["SP", 4, 20, 128, [2, 16], 1], ["RE", 4, [0, 5, 10, 15, 1, 6, 11, 16, 2, 7, 12, 17, 20, 21, 3, 8, 13, 18, 22, 4, 9, 14, 19]], ["FSP", 5, 0, 11, 3], ["FSP", 5, 4, 12, 3], ["FSP", 5, 8, 13, 3], ["FSP", 5, 12, 14, 3], ["RE", 5, [0, 4, 8, 12, 1, 5, 9, 13, 2, 6, 10, 14, 3, 7, 11, 15]], ["CA", 4, 5, 11], ["CHR", 3, "shared", [4]], ["CA", 4, 5, 12], ["CI", 3], ["CHR", 1, "shared", [5]], ["CA", 2, 6, 12], ["CI", 1], ["FU", 7, [0, 1, 2, 3]], ["AN", 7, 0, 5], ["FU", 7, [1, 2, 3, 4]], ["AN", 7, 1, 4], ["FU", 7, [2, 3, 4, 5]], ["AN", 7, 2, 6], ["FU", 12, [0, 1, 2]], ["AN", 12, 0, 5], ["FU", 2, [0, 1, 2, 3]], ["SP", 2, 0, 16, [4], 1], ["AN", 2, 1, 2], ["FFSP", 2, 0, [14, 13, 12, 11], 1, 1], ["AN", 2, 1, 6], ["FU", 5, [0, 1, 2, 3]], ["SP", 5, 0, 128, [8], 1], ["AN", 5, 1, 2], ["FFSP", 5, 0, [14, 13, 12, 11], 1, 1], ["AN", 5, 1, 6], ["PR", 6, 0, "auto_unroll_max_step$1024"]]]], "r": [[0.000133028], 0, 3.69097, 1594599981], "v": "v0.2"}
